foodbank_id,description
514,sit amet turpis elementum ligula vehicula consequat morbi a ipsum integer a nibh in quis justo
515,vestibulum sagittis sapien cum sociis natoque penatibus et magnis dis parturient montes nascetur ridiculus mus
516,quis orci eget orci vehicula condimentum curabitur in libero ut massa volutpat convallis morbi odio odio elementum eu
517,lectus aliquam sit amet diam in magna bibendum imperdiet nullam orci pede venenatis non sodales sed tincidunt eu felis fusce
518,vestibulum quam sapien varius ut blandit non interdum in ante
519,vestibulum vestibulum ante ipsum primis in faucibus orci luctus et ultrices
520,consectetuer eget rutrum at lorem integer tincidunt ante vel ipsum praesent blandit lacinia
521,at turpis a pede posuere nonummy integer non velit donec diam neque
522,amet lobortis sapien sapien non mi integer ac neque duis bibendum morbi non quam nec dui luctus
523,auctor sed tristique in tempus sit amet sem fusce consequat
524,quam a odio in hac habitasse platea dictumst maecenas ut massa quis augue luctus tincidunt nulla mollis
525,dictumst aliquam augue quam sollicitudin vitae consectetuer eget rutrum at lorem integer tincidunt ante vel
526,ligula nec sem duis aliquam convallis nunc proin at turpis a
527,vulputate elementum nullam varius nulla facilisi cras non velit nec nisi
528,curae mauris viverra diam vitae quam suspendisse potenti nullam porttitor lacus at turpis
529,aliquam erat volutpat in congue etiam justo etiam pretium iaculis justo in hac habitasse platea dictumst etiam faucibus cursus urna
530,phasellus in felis donec semper sapien a libero nam dui proin leo odio porttitor id consequat in consequat
531,maecenas rhoncus aliquam lacus morbi quis tortor id nulla ultrices aliquet
532,odio condimentum id luctus nec molestie sed justo pellentesque viverra pede ac
533,sem praesent id massa id nisl venenatis lacinia aenean sit amet justo morbi ut odio cras mi pede
534,diam neque vestibulum eget vulputate ut ultrices vel augue vestibulum ante ipsum primis in faucibus orci luctus et ultrices
535,convallis tortor risus dapibus augue vel accumsan tellus nisi eu orci mauris lacinia sapien quis libero nullam sit
536,mattis nibh ligula nec sem duis aliquam convallis nunc proin at turpis a pede posuere nonummy integer non velit
537,sapien ut nunc vestibulum ante ipsum primis in faucibus orci luctus et ultrices posuere cubilia curae mauris viverra diam vitae
538,donec vitae nisi nam ultrices libero non mattis pulvinar nulla pede
539,ut massa volutpat convallis morbi odio odio elementum eu interdum eu tincidunt in leo maecenas pulvinar lobortis est
540,sagittis nam congue risus semper porta volutpat quam pede lobortis ligula sit amet eleifend pede
541,platea dictumst etiam faucibus cursus urna ut tellus nulla ut erat id mauris vulputate elementum nullam varius nulla facilisi cras
542,amet nulla quisque arcu libero rutrum ac lobortis vel dapibus at diam nam tristique tortor eu
543,ultrices libero non mattis pulvinar nulla pede ullamcorper augue a suscipit nulla elit ac nulla
544,lacus at velit vivamus vel nulla eget eros elementum pellentesque quisque porta volutpat erat quisque erat eros viverra
545,volutpat convallis morbi odio odio elementum eu interdum eu tincidunt in leo maecenas
546,augue luctus tincidunt nulla mollis molestie lorem quisque ut erat curabitur
547,montes nascetur ridiculus mus etiam vel augue vestibulum rutrum rutrum neque aenean
548,sit amet erat nulla tempus vivamus in felis eu sapien cursus vestibulum proin eu mi
549,non mi integer ac neque duis bibendum morbi non quam nec dui luctus
550,posuere nonummy integer non velit donec diam neque vestibulum eget
551,a odio in hac habitasse platea dictumst maecenas ut massa quis augue luctus tincidunt nulla
552,sapien quis libero nullam sit amet turpis elementum ligula vehicula consequat morbi a ipsum integer a
553,urna ut tellus nulla ut erat id mauris vulputate elementum nullam
554,ac tellus semper interdum mauris ullamcorper purus sit amet nulla quisque
555,est donec odio justo sollicitudin ut suscipit a feugiat et eros vestibulum ac est lacinia nisi venenatis tristique fusce
556,curae mauris viverra diam vitae quam suspendisse potenti nullam porttitor lacus at turpis donec posuere metus vitae ipsum
557,scelerisque quam turpis adipiscing lorem vitae mattis nibh ligula nec sem duis aliquam convallis nunc proin at turpis a
558,erat curabitur gravida nisi at nibh in hac habitasse platea dictumst aliquam augue quam sollicitudin vitae consectetuer eget rutrum
559,tempor turpis nec euismod scelerisque quam turpis adipiscing lorem vitae mattis
560,natoque penatibus et magnis dis parturient montes nascetur ridiculus mus etiam vel augue vestibulum rutrum rutrum neque
561,nisl nunc nisl duis bibendum felis sed interdum venenatis turpis enim blandit mi in
562,elementum nullam varius nulla facilisi cras non velit nec nisi vulputate nonummy maecenas
563,ut massa volutpat convallis morbi odio odio elementum eu interdum eu tincidunt in leo maecenas pulvinar lobortis
564,ligula nec sem duis aliquam convallis nunc proin at turpis a pede posuere nonummy integer non
565,pulvinar nulla pede ullamcorper augue a suscipit nulla elit ac nulla sed vel enim sit
566,varius ut blandit non interdum in ante vestibulum ante ipsum primis in faucibus orci luctus
567,magna bibendum imperdiet nullam orci pede venenatis non sodales sed tincidunt eu felis fusce posuere felis sed
568,erat quisque erat eros viverra eget congue eget semper rutrum nulla nunc purus phasellus in felis
569,tellus semper interdum mauris ullamcorper purus sit amet nulla quisque arcu libero rutrum ac lobortis vel dapibus at
570,pretium quis lectus suspendisse potenti in eleifend quam a odio in hac habitasse platea dictumst maecenas
571,vehicula consequat morbi a ipsum integer a nibh in quis justo maecenas
572,vulputate nonummy maecenas tincidunt lacus at velit vivamus vel nulla eget
573,molestie nibh in lectus pellentesque at nulla suspendisse potenti cras in purus eu magna vulputate luctus cum
574,lorem quisque ut erat curabitur gravida nisi at nibh in hac habitasse platea dictumst aliquam augue quam
575,non mauris morbi non lectus aliquam sit amet diam in magna bibendum imperdiet nullam orci pede venenatis
576,curabitur at ipsum ac tellus semper interdum mauris ullamcorper purus sit amet nulla quisque arcu libero rutrum ac
577,donec ut dolor morbi vel lectus in quam fringilla rhoncus mauris enim leo rhoncus sed vestibulum sit
578,sem duis aliquam convallis nunc proin at turpis a pede posuere nonummy integer non velit donec diam neque vestibulum
579,at vulputate vitae nisl aenean lectus pellentesque eget nunc donec quis orci eget orci vehicula condimentum curabitur in libero
580,justo etiam pretium iaculis justo in hac habitasse platea dictumst etiam faucibus cursus urna
581,tincidunt lacus at velit vivamus vel nulla eget eros elementum pellentesque quisque porta volutpat erat quisque erat eros
582,sed justo pellentesque viverra pede ac diam cras pellentesque volutpat dui maecenas
583,ipsum primis in faucibus orci luctus et ultrices posuere cubilia curae duis
584,lorem quisque ut erat curabitur gravida nisi at nibh in hac habitasse platea dictumst aliquam augue
585,nulla nunc purus phasellus in felis donec semper sapien a libero nam dui proin leo odio porttitor id consequat in
586,enim in tempor turpis nec euismod scelerisque quam turpis adipiscing lorem vitae mattis nibh
587,faucibus orci luctus et ultrices posuere cubilia curae mauris viverra diam vitae quam suspendisse potenti nullam porttitor lacus at
588,magnis dis parturient montes nascetur ridiculus mus etiam vel augue vestibulum
589,sagittis sapien cum sociis natoque penatibus et magnis dis parturient montes nascetur ridiculus mus etiam vel augue
590,interdum in ante vestibulum ante ipsum primis in faucibus orci luctus et ultrices posuere cubilia curae duis faucibus accumsan odio
591,cum sociis natoque penatibus et magnis dis parturient montes nascetur ridiculus mus etiam
592,in congue etiam justo etiam pretium iaculis justo in hac habitasse platea dictumst etiam faucibus
593,aenean lectus pellentesque eget nunc donec quis orci eget orci vehicula condimentum curabitur in
594,proin eu mi nulla ac enim in tempor turpis nec euismod scelerisque quam turpis adipiscing
595,posuere cubilia curae duis faucibus accumsan odio curabitur convallis duis consequat dui nec nisi volutpat eleifend
596,eleifend donec ut dolor morbi vel lectus in quam fringilla rhoncus mauris enim leo
597,nam congue risus semper porta volutpat quam pede lobortis ligula sit amet eleifend pede libero quis orci nullam molestie
598,hendrerit at vulputate vitae nisl aenean lectus pellentesque eget nunc donec quis
599,non ligula pellentesque ultrices phasellus id sapien in sapien iaculis congue vivamus metus arcu adipiscing molestie
600,ac nibh fusce lacus purus aliquet at feugiat non pretium
601,vitae consectetuer eget rutrum at lorem integer tincidunt ante vel ipsum
602,quis turpis sed ante vivamus tortor duis mattis egestas metus aenean
603,lacus morbi quis tortor id nulla ultrices aliquet maecenas leo odio condimentum id luctus nec molestie sed justo pellentesque viverra
604,risus auctor sed tristique in tempus sit amet sem fusce consequat nulla nisl nunc
605,et ultrices posuere cubilia curae nulla dapibus dolor vel est donec
606,et magnis dis parturient montes nascetur ridiculus mus etiam vel augue vestibulum rutrum rutrum neque aenean auctor gravida sem
607,viverra eget congue eget semper rutrum nulla nunc purus phasellus in
608,rhoncus aliquet pulvinar sed nisl nunc rhoncus dui vel sem sed sagittis nam congue risus semper
609,nonummy integer non velit donec diam neque vestibulum eget vulputate ut ultrices vel augue vestibulum ante ipsum primis in
610,nulla mollis molestie lorem quisque ut erat curabitur gravida nisi
611,est lacinia nisi venenatis tristique fusce congue diam id ornare imperdiet sapien urna
612,purus phasellus in felis donec semper sapien a libero nam
613,est phasellus sit amet erat nulla tempus vivamus in felis eu sapien cursus vestibulum
614,nisl ut volutpat sapien arcu sed augue aliquam erat volutpat in congue etiam justo
615,nulla suscipit ligula in lacus curabitur at ipsum ac tellus semper interdum mauris ullamcorper purus sit
616,vitae consectetuer eget rutrum at lorem integer tincidunt ante vel ipsum
617,vulputate vitae nisl aenean lectus pellentesque eget nunc donec quis orci eget orci vehicula condimentum curabitur in libero ut
618,sit amet eros suspendisse accumsan tortor quis turpis sed ante vivamus tortor duis mattis egestas metus aenean fermentum
619,facilisi cras non velit nec nisi vulputate nonummy maecenas tincidunt lacus at velit vivamus vel nulla
620,curabitur convallis duis consequat dui nec nisi volutpat eleifend donec ut dolor morbi vel lectus in quam
621,mi sit amet lobortis sapien sapien non mi integer ac neque duis bibendum morbi
622,donec dapibus duis at velit eu est congue elementum in hac habitasse platea dictumst morbi vestibulum velit
623,donec pharetra magna vestibulum aliquet ultrices erat tortor sollicitudin mi sit amet lobortis sapien sapien non mi integer
624,vel nulla eget eros elementum pellentesque quisque porta volutpat erat quisque erat eros viverra eget congue eget
625,auctor sed tristique in tempus sit amet sem fusce consequat nulla
626,vivamus vel nulla eget eros elementum pellentesque quisque porta volutpat erat quisque erat eros viverra eget congue
627,nulla sed accumsan felis ut at dolor quis odio consequat
628,faucibus accumsan odio curabitur convallis duis consequat dui nec nisi volutpat eleifend donec ut dolor morbi vel
629,libero quis orci nullam molestie nibh in lectus pellentesque at nulla suspendisse potenti cras in purus eu magna
630,donec vitae nisi nam ultrices libero non mattis pulvinar nulla pede ullamcorper augue a suscipit
631,dui luctus rutrum nulla tellus in sagittis dui vel nisl duis ac nibh fusce lacus purus aliquet
632,ridiculus mus vivamus vestibulum sagittis sapien cum sociis natoque penatibus et magnis dis parturient montes nascetur
633,pede morbi porttitor lorem id ligula suspendisse ornare consequat lectus in est risus auctor sed tristique in tempus
634,a odio in hac habitasse platea dictumst maecenas ut massa quis augue luctus tincidunt
635,fermentum justo nec condimentum neque sapien placerat ante nulla justo aliquam quis turpis eget elit sodales scelerisque
636,purus sit amet nulla quisque arcu libero rutrum ac lobortis vel dapibus at diam nam
637,interdum mauris ullamcorper purus sit amet nulla quisque arcu libero
638,in hac habitasse platea dictumst etiam faucibus cursus urna ut
639,sapien arcu sed augue aliquam erat volutpat in congue etiam justo etiam pretium
640,sed interdum venenatis turpis enim blandit mi in porttitor pede justo eu massa donec dapibus duis
641,integer ac neque duis bibendum morbi non quam nec dui luctus rutrum nulla tellus in sagittis dui vel
642,nulla tellus in sagittis dui vel nisl duis ac nibh fusce lacus purus aliquet at feugiat non pretium
643,justo eu massa donec dapibus duis at velit eu est congue
644,metus sapien ut nunc vestibulum ante ipsum primis in faucibus orci
645,leo maecenas pulvinar lobortis est phasellus sit amet erat nulla tempus vivamus
646,vestibulum ante ipsum primis in faucibus orci luctus et ultrices posuere cubilia curae
647,nulla tellus in sagittis dui vel nisl duis ac nibh fusce lacus purus aliquet at feugiat non
648,eleifend donec ut dolor morbi vel lectus in quam fringilla rhoncus mauris enim leo rhoncus sed
649,lacus at turpis donec posuere metus vitae ipsum aliquam non mauris morbi non lectus aliquam sit
650,odio consequat varius integer ac leo pellentesque ultrices mattis odio donec vitae nisi nam ultrices libero non
651,cubilia curae mauris viverra diam vitae quam suspendisse potenti nullam porttitor lacus at turpis
652,sodales scelerisque mauris sit amet eros suspendisse accumsan tortor quis turpis
653,at nibh in hac habitasse platea dictumst aliquam augue quam sollicitudin
654,purus eu magna vulputate luctus cum sociis natoque penatibus et magnis dis parturient montes nascetur ridiculus
655,sit amet lobortis sapien sapien non mi integer ac neque duis bibendum morbi non quam nec dui luctus rutrum
656,consectetuer eget rutrum at lorem integer tincidunt ante vel ipsum praesent blandit lacinia erat
657,imperdiet nullam orci pede venenatis non sodales sed tincidunt eu felis fusce posuere felis sed
658,penatibus et magnis dis parturient montes nascetur ridiculus mus etiam vel augue
659,mattis odio donec vitae nisi nam ultrices libero non mattis pulvinar nulla pede ullamcorper augue a suscipit nulla elit
660,convallis tortor risus dapibus augue vel accumsan tellus nisi eu orci mauris lacinia sapien quis
661,phasellus sit amet erat nulla tempus vivamus in felis eu sapien cursus vestibulum proin eu mi nulla ac enim in
662,rhoncus sed vestibulum sit amet cursus id turpis integer aliquet massa id
663,semper interdum mauris ullamcorper purus sit amet nulla quisque arcu libero rutrum ac lobortis vel dapibus at
664,in blandit ultrices enim lorem ipsum dolor sit amet consectetuer adipiscing elit proin interdum mauris non
665,vestibulum ac est lacinia nisi venenatis tristique fusce congue diam id ornare imperdiet sapien urna
666,nulla dapibus dolor vel est donec odio justo sollicitudin ut suscipit a feugiat et
667,amet sapien dignissim vestibulum vestibulum ante ipsum primis in faucibus orci luctus et ultrices posuere cubilia curae
668,donec pharetra magna vestibulum aliquet ultrices erat tortor sollicitudin mi sit amet lobortis sapien sapien non mi integer ac
669,in tempor turpis nec euismod scelerisque quam turpis adipiscing lorem vitae mattis nibh ligula
670,est donec odio justo sollicitudin ut suscipit a feugiat et eros vestibulum ac est lacinia nisi venenatis tristique
671,mauris non ligula pellentesque ultrices phasellus id sapien in sapien iaculis congue vivamus metus arcu adipiscing molestie hendrerit at vulputate
672,erat id mauris vulputate elementum nullam varius nulla facilisi cras non velit nec nisi vulputate nonummy
673,integer tincidunt ante vel ipsum praesent blandit lacinia erat vestibulum
674,erat tortor sollicitudin mi sit amet lobortis sapien sapien non mi integer ac neque duis
675,sed lacus morbi sem mauris laoreet ut rhoncus aliquet pulvinar sed nisl nunc rhoncus
676,vestibulum velit id pretium iaculis diam erat fermentum justo nec condimentum
677,integer non velit donec diam neque vestibulum eget vulputate ut ultrices vel augue vestibulum ante ipsum primis in
678,platea dictumst aliquam augue quam sollicitudin vitae consectetuer eget rutrum at lorem integer tincidunt ante vel ipsum praesent blandit lacinia
679,tempor turpis nec euismod scelerisque quam turpis adipiscing lorem vitae mattis nibh ligula nec sem duis aliquam
680,eget tincidunt eget tempus vel pede morbi porttitor lorem id ligula suspendisse ornare consequat lectus in est
681,enim blandit mi in porttitor pede justo eu massa donec dapibus duis
682,hac habitasse platea dictumst aliquam augue quam sollicitudin vitae consectetuer eget
683,amet sem fusce consequat nulla nisl nunc nisl duis bibendum felis sed interdum
684,cras non velit nec nisi vulputate nonummy maecenas tincidunt lacus at velit vivamus vel nulla eget eros elementum pellentesque
685,ut nunc vestibulum ante ipsum primis in faucibus orci luctus et ultrices posuere cubilia curae mauris viverra
686,duis bibendum felis sed interdum venenatis turpis enim blandit mi in porttitor pede justo eu massa donec
687,justo nec condimentum neque sapien placerat ante nulla justo aliquam quis turpis eget elit sodales scelerisque mauris
688,sapien sapien non mi integer ac neque duis bibendum morbi non quam nec dui luctus rutrum nulla tellus
689,tempus vivamus in felis eu sapien cursus vestibulum proin eu mi nulla ac enim in tempor turpis nec euismod
690,aliquet maecenas leo odio condimentum id luctus nec molestie sed justo pellentesque viverra
691,amet sapien dignissim vestibulum vestibulum ante ipsum primis in faucibus orci luctus et ultrices posuere cubilia curae
692,eu est congue elementum in hac habitasse platea dictumst morbi vestibulum velit id pretium iaculis diam erat fermentum justo nec
693,dui luctus rutrum nulla tellus in sagittis dui vel nisl duis ac nibh
694,eget massa tempor convallis nulla neque libero convallis eget eleifend luctus ultricies eu nibh quisque id justo sit amet
695,nulla mollis molestie lorem quisque ut erat curabitur gravida nisi at nibh in hac habitasse
696,eu est congue elementum in hac habitasse platea dictumst morbi vestibulum velit
697,integer ac neque duis bibendum morbi non quam nec dui luctus rutrum
698,primis in faucibus orci luctus et ultrices posuere cubilia curae mauris viverra diam vitae quam suspendisse
699,auctor sed tristique in tempus sit amet sem fusce consequat nulla nisl nunc nisl duis
700,turpis integer aliquet massa id lobortis convallis tortor risus dapibus augue vel accumsan tellus nisi eu orci mauris
701,venenatis non sodales sed tincidunt eu felis fusce posuere felis sed lacus morbi sem mauris laoreet
702,tincidunt nulla mollis molestie lorem quisque ut erat curabitur gravida nisi at
703,suscipit a feugiat et eros vestibulum ac est lacinia nisi venenatis tristique fusce congue diam id ornare
704,felis sed lacus morbi sem mauris laoreet ut rhoncus aliquet pulvinar sed nisl nunc rhoncus dui vel sem sed
705,potenti nullam porttitor lacus at turpis donec posuere metus vitae ipsum aliquam non mauris morbi non lectus
706,amet consectetuer adipiscing elit proin risus praesent lectus vestibulum quam sapien varius ut blandit non interdum in
707,mattis odio donec vitae nisi nam ultrices libero non mattis pulvinar nulla pede ullamcorper augue a
708,nisl duis ac nibh fusce lacus purus aliquet at feugiat
709,neque duis bibendum morbi non quam nec dui luctus rutrum nulla tellus in sagittis dui vel nisl
710,eros vestibulum ac est lacinia nisi venenatis tristique fusce congue diam id ornare imperdiet sapien
711,quisque id justo sit amet sapien dignissim vestibulum vestibulum ante ipsum primis in faucibus orci luctus et ultrices posuere cubilia
712,congue elementum in hac habitasse platea dictumst morbi vestibulum velit id pretium iaculis diam erat fermentum justo nec condimentum neque
713,in lectus pellentesque at nulla suspendisse potenti cras in purus eu magna vulputate luctus cum sociis
714,eleifend quam a odio in hac habitasse platea dictumst maecenas ut massa quis augue luctus
715,quis orci nullam molestie nibh in lectus pellentesque at nulla suspendisse potenti cras in purus eu magna vulputate luctus cum
716,rutrum neque aenean auctor gravida sem praesent id massa id nisl venenatis lacinia aenean sit amet justo morbi ut
717,dictumst etiam faucibus cursus urna ut tellus nulla ut erat id mauris vulputate elementum
718,ut massa volutpat convallis morbi odio odio elementum eu interdum eu tincidunt in leo maecenas pulvinar lobortis est
719,ligula sit amet eleifend pede libero quis orci nullam molestie nibh in lectus pellentesque at nulla suspendisse
720,luctus tincidunt nulla mollis molestie lorem quisque ut erat curabitur gravida nisi at nibh in hac
721,sed augue aliquam erat volutpat in congue etiam justo etiam pretium iaculis justo
722,pede libero quis orci nullam molestie nibh in lectus pellentesque at nulla suspendisse potenti
723,nec molestie sed justo pellentesque viverra pede ac diam cras pellentesque volutpat dui maecenas
724,amet turpis elementum ligula vehicula consequat morbi a ipsum integer a nibh in quis justo
725,cras pellentesque volutpat dui maecenas tristique est et tempus semper est quam pharetra
726,eget tempus vel pede morbi porttitor lorem id ligula suspendisse ornare consequat lectus
727,lectus pellentesque eget nunc donec quis orci eget orci vehicula condimentum curabitur in libero ut massa volutpat convallis morbi
728,ut mauris eget massa tempor convallis nulla neque libero convallis eget eleifend luctus ultricies eu nibh quisque
729,ipsum primis in faucibus orci luctus et ultrices posuere cubilia curae mauris viverra diam vitae quam suspendisse potenti
730,eu felis fusce posuere felis sed lacus morbi sem mauris laoreet ut rhoncus aliquet pulvinar sed nisl nunc rhoncus dui
731,cras non velit nec nisi vulputate nonummy maecenas tincidunt lacus at velit vivamus vel nulla eget eros elementum pellentesque
732,ut blandit non interdum in ante vestibulum ante ipsum primis in faucibus orci luctus et ultrices
733,interdum eu tincidunt in leo maecenas pulvinar lobortis est phasellus sit amet erat nulla tempus vivamus in
734,auctor sed tristique in tempus sit amet sem fusce consequat nulla nisl nunc nisl duis bibendum
735,quisque id justo sit amet sapien dignissim vestibulum vestibulum ante ipsum primis in faucibus orci luctus
736,nulla pede ullamcorper augue a suscipit nulla elit ac nulla sed vel enim sit amet nunc viverra dapibus nulla suscipit
737,ut erat id mauris vulputate elementum nullam varius nulla facilisi cras non velit nec
738,lacus purus aliquet at feugiat non pretium quis lectus suspendisse
739,sodales sed tincidunt eu felis fusce posuere felis sed lacus morbi sem mauris laoreet ut rhoncus aliquet pulvinar sed nisl
740,amet consectetuer adipiscing elit proin interdum mauris non ligula pellentesque ultrices phasellus
741,dui maecenas tristique est et tempus semper est quam pharetra magna ac consequat metus sapien ut nunc vestibulum ante
742,sit amet diam in magna bibendum imperdiet nullam orci pede venenatis
743,neque aenean auctor gravida sem praesent id massa id nisl venenatis lacinia aenean sit amet justo
744,cubilia curae nulla dapibus dolor vel est donec odio justo sollicitudin ut suscipit a feugiat et eros vestibulum
745,habitasse platea dictumst maecenas ut massa quis augue luctus tincidunt nulla mollis molestie lorem
746,augue vestibulum rutrum rutrum neque aenean auctor gravida sem praesent id
747,amet eros suspendisse accumsan tortor quis turpis sed ante vivamus tortor duis mattis egestas metus aenean fermentum
748,sit amet erat nulla tempus vivamus in felis eu sapien cursus vestibulum proin eu mi
749,lacus curabitur at ipsum ac tellus semper interdum mauris ullamcorper purus sit amet nulla quisque arcu
750,faucibus orci luctus et ultrices posuere cubilia curae donec pharetra magna vestibulum aliquet ultrices erat tortor sollicitudin mi sit
751,vestibulum rutrum rutrum neque aenean auctor gravida sem praesent id massa id nisl venenatis
752,odio elementum eu interdum eu tincidunt in leo maecenas pulvinar lobortis est phasellus
753,elementum ligula vehicula consequat morbi a ipsum integer a nibh in quis
754,nam dui proin leo odio porttitor id consequat in consequat ut
755,at ipsum ac tellus semper interdum mauris ullamcorper purus sit amet nulla quisque arcu libero rutrum ac lobortis
756,consequat metus sapien ut nunc vestibulum ante ipsum primis in faucibus orci luctus et ultrices posuere cubilia curae
757,maecenas ut massa quis augue luctus tincidunt nulla mollis molestie lorem quisque ut erat curabitur gravida nisi
758,nascetur ridiculus mus vivamus vestibulum sagittis sapien cum sociis natoque penatibus et magnis dis parturient montes
759,duis faucibus accumsan odio curabitur convallis duis consequat dui nec nisi volutpat eleifend donec ut dolor
760,mi in porttitor pede justo eu massa donec dapibus duis at velit eu
761,potenti nullam porttitor lacus at turpis donec posuere metus vitae ipsum aliquam non mauris morbi non
762,viverra dapibus nulla suscipit ligula in lacus curabitur at ipsum ac tellus semper interdum mauris ullamcorper purus
763,nulla nunc purus phasellus in felis donec semper sapien a libero
