foodbank_id,description
1,vestibulum aliquet ultrices erat tortor sollicitudin mi sit amet lobortis sapien sapien non mi integer ac neque duis bibendum
2,amet sem fusce consequat nulla nisl nunc nisl duis bibendum felis sed interdum venenatis
3,sit amet nulla quisque arcu libero rutrum ac lobortis vel dapibus at diam nam tristique
4,ipsum aliquam non mauris morbi non lectus aliquam sit amet diam in magna bibendum imperdiet nullam orci pede venenatis
5,lacinia sapien quis libero nullam sit amet turpis elementum ligula vehicula consequat morbi a ipsum integer a nibh in
6,dis parturient montes nascetur ridiculus mus etiam vel augue vestibulum rutrum rutrum neque aenean
7,tincidunt lacus at velit vivamus vel nulla eget eros elementum pellentesque quisque
8,nulla neque libero convallis eget eleifend luctus ultricies eu nibh quisque id
9,suscipit ligula in lacus curabitur at ipsum ac tellus semper interdum mauris ullamcorper purus sit amet nulla
10,quam turpis adipiscing lorem vitae mattis nibh ligula nec sem duis aliquam
11,viverra diam vitae quam suspendisse potenti nullam porttitor lacus at turpis donec posuere metus vitae ipsum aliquam non mauris
12,morbi odio odio elementum eu interdum eu tincidunt in leo maecenas pulvinar lobortis est phasellus sit amet
13,sem fusce consequat nulla nisl nunc nisl duis bibendum felis sed interdum venenatis turpis enim blandit mi in porttitor pede
14,ligula suspendisse ornare consequat lectus in est risus auctor sed tristique in tempus sit amet sem fusce consequat
15,et magnis dis parturient montes nascetur ridiculus mus vivamus vestibulum sagittis sapien cum sociis
16,ut mauris eget massa tempor convallis nulla neque libero convallis eget eleifend luctus
17,eleifend quam a odio in hac habitasse platea dictumst maecenas ut massa quis augue luctus tincidunt nulla mollis molestie
18,nulla ut erat id mauris vulputate elementum nullam varius nulla facilisi cras non velit nec nisi vulputate nonummy
19,ut massa volutpat convallis morbi odio odio elementum eu interdum eu tincidunt in leo maecenas pulvinar
20,in libero ut massa volutpat convallis morbi odio odio elementum eu interdum
21,in congue etiam justo etiam pretium iaculis justo in hac habitasse platea dictumst etiam faucibus cursus
22,porta volutpat erat quisque erat eros viverra eget congue eget semper rutrum nulla nunc purus phasellus in felis
23,leo maecenas pulvinar lobortis est phasellus sit amet erat nulla tempus vivamus in felis eu
24,scelerisque quam turpis adipiscing lorem vitae mattis nibh ligula nec sem duis aliquam convallis nunc proin
25,magnis dis parturient montes nascetur ridiculus mus etiam vel augue
26,eu magna vulputate luctus cum sociis natoque penatibus et magnis dis parturient montes nascetur
27,interdum in ante vestibulum ante ipsum primis in faucibus orci luctus et ultrices posuere cubilia curae
28,rutrum neque aenean auctor gravida sem praesent id massa id nisl venenatis lacinia aenean
29,ullamcorper purus sit amet nulla quisque arcu libero rutrum ac lobortis vel dapibus at diam nam
30,rutrum rutrum neque aenean auctor gravida sem praesent id massa id nisl venenatis lacinia aenean sit amet justo
31,sem fusce consequat nulla nisl nunc nisl duis bibendum felis sed interdum venenatis turpis enim blandit mi in porttitor pede
32,phasellus sit amet erat nulla tempus vivamus in felis eu sapien cursus vestibulum proin
33,magna vulputate luctus cum sociis natoque penatibus et magnis dis parturient montes nascetur ridiculus mus
34,morbi odio odio elementum eu interdum eu tincidunt in leo maecenas pulvinar lobortis est
35,curabitur convallis duis consequat dui nec nisi volutpat eleifend donec ut dolor morbi vel lectus
36,congue vivamus metus arcu adipiscing molestie hendrerit at vulputate vitae nisl aenean lectus pellentesque eget nunc donec quis orci eget
37,vestibulum ante ipsum primis in faucibus orci luctus et ultrices posuere cubilia curae duis faucibus
38,vulputate nonummy maecenas tincidunt lacus at velit vivamus vel nulla eget
39,purus sit amet nulla quisque arcu libero rutrum ac lobortis vel dapibus at diam nam
40,vel nisl duis ac nibh fusce lacus purus aliquet at
41,lorem vitae mattis nibh ligula nec sem duis aliquam convallis nunc proin at turpis
42,justo sit amet sapien dignissim vestibulum vestibulum ante ipsum primis in faucibus orci luctus et
43,nec condimentum neque sapien placerat ante nulla justo aliquam quis turpis eget elit sodales scelerisque mauris sit amet eros suspendisse
44,tortor sollicitudin mi sit amet lobortis sapien sapien non mi integer ac neque
45,in purus eu magna vulputate luctus cum sociis natoque penatibus et magnis
46,turpis enim blandit mi in porttitor pede justo eu massa donec dapibus duis
47,odio condimentum id luctus nec molestie sed justo pellentesque viverra pede ac diam
48,pretium iaculis justo in hac habitasse platea dictumst etiam faucibus cursus urna ut tellus nulla
49,eget nunc donec quis orci eget orci vehicula condimentum curabitur in libero ut massa volutpat convallis morbi odio odio
50,pellentesque viverra pede ac diam cras pellentesque volutpat dui maecenas tristique est et tempus
51,et commodo vulputate justo in blandit ultrices enim lorem ipsum dolor sit amet consectetuer adipiscing elit proin interdum mauris non
52,neque aenean auctor gravida sem praesent id massa id nisl venenatis lacinia aenean sit amet justo morbi ut odio cras
53,non velit donec diam neque vestibulum eget vulputate ut ultrices vel
54,metus sapien ut nunc vestibulum ante ipsum primis in faucibus orci luctus et ultrices posuere cubilia curae
55,amet eleifend pede libero quis orci nullam molestie nibh in lectus pellentesque at nulla suspendisse potenti
56,maecenas leo odio condimentum id luctus nec molestie sed justo pellentesque viverra pede ac diam cras pellentesque volutpat dui maecenas
57,bibendum morbi non quam nec dui luctus rutrum nulla tellus in sagittis dui vel nisl duis ac nibh fusce lacus
58,ut blandit non interdum in ante vestibulum ante ipsum primis in faucibus orci luctus
59,sociis natoque penatibus et magnis dis parturient montes nascetur ridiculus mus etiam vel augue vestibulum rutrum
60,donec semper sapien a libero nam dui proin leo odio porttitor id consequat
61,etiam faucibus cursus urna ut tellus nulla ut erat id
62,faucibus orci luctus et ultrices posuere cubilia curae donec pharetra magna vestibulum aliquet
63,eu sapien cursus vestibulum proin eu mi nulla ac enim
64,sed justo pellentesque viverra pede ac diam cras pellentesque volutpat dui maecenas tristique est
65,viverra diam vitae quam suspendisse potenti nullam porttitor lacus at turpis donec posuere metus vitae ipsum aliquam non
66,est quam pharetra magna ac consequat metus sapien ut nunc vestibulum ante ipsum
67,quis turpis sed ante vivamus tortor duis mattis egestas metus aenean fermentum donec ut
68,justo etiam pretium iaculis justo in hac habitasse platea dictumst
69,metus sapien ut nunc vestibulum ante ipsum primis in faucibus orci
70,nunc rhoncus dui vel sem sed sagittis nam congue risus semper porta volutpat quam pede lobortis ligula
71,sem sed sagittis nam congue risus semper porta volutpat quam pede lobortis
72,vestibulum quam sapien varius ut blandit non interdum in ante vestibulum ante ipsum primis in faucibus orci luctus et ultrices
73,velit nec nisi vulputate nonummy maecenas tincidunt lacus at velit vivamus vel nulla eget eros elementum pellentesque quisque porta
74,amet sem fusce consequat nulla nisl nunc nisl duis bibendum felis
75,cubilia curae duis faucibus accumsan odio curabitur convallis duis consequat dui nec nisi volutpat eleifend
76,augue aliquam erat volutpat in congue etiam justo etiam pretium iaculis justo in hac habitasse platea dictumst etiam faucibus cursus
77,aliquam convallis nunc proin at turpis a pede posuere nonummy integer
78,imperdiet et commodo vulputate justo in blandit ultrices enim lorem ipsum dolor sit
79,dolor sit amet consectetuer adipiscing elit proin interdum mauris non ligula pellentesque ultrices phasellus id
80,pretium iaculis justo in hac habitasse platea dictumst etiam faucibus cursus urna ut tellus
81,mus vivamus vestibulum sagittis sapien cum sociis natoque penatibus et magnis dis parturient montes
82,non velit donec diam neque vestibulum eget vulputate ut ultrices vel augue vestibulum ante ipsum
83,dapibus dolor vel est donec odio justo sollicitudin ut suscipit a feugiat et eros vestibulum ac est
84,faucibus cursus urna ut tellus nulla ut erat id mauris vulputate
85,in quis justo maecenas rhoncus aliquam lacus morbi quis tortor id nulla
86,pede justo eu massa donec dapibus duis at velit eu est
87,curae mauris viverra diam vitae quam suspendisse potenti nullam porttitor
88,ac leo pellentesque ultrices mattis odio donec vitae nisi nam ultrices libero non mattis pulvinar nulla pede ullamcorper
89,sem fusce consequat nulla nisl nunc nisl duis bibendum felis sed interdum venenatis turpis enim blandit mi in porttitor pede
90,interdum eu tincidunt in leo maecenas pulvinar lobortis est phasellus sit amet erat nulla tempus vivamus
91,nulla suspendisse potenti cras in purus eu magna vulputate luctus cum sociis
92,convallis tortor risus dapibus augue vel accumsan tellus nisi eu orci mauris lacinia sapien quis libero nullam sit amet turpis
93,mauris laoreet ut rhoncus aliquet pulvinar sed nisl nunc rhoncus dui vel sem sed sagittis nam congue risus semper
94,dui luctus rutrum nulla tellus in sagittis dui vel nisl
95,ut volutpat sapien arcu sed augue aliquam erat volutpat in congue etiam
96,dis parturient montes nascetur ridiculus mus etiam vel augue vestibulum rutrum rutrum neque aenean
97,consectetuer eget rutrum at lorem integer tincidunt ante vel ipsum praesent blandit lacinia erat vestibulum sed magna
98,sapien cursus vestibulum proin eu mi nulla ac enim in tempor turpis nec euismod scelerisque quam turpis adipiscing lorem vitae
99,ridiculus mus vivamus vestibulum sagittis sapien cum sociis natoque penatibus et magnis
100,turpis elementum ligula vehicula consequat morbi a ipsum integer a nibh
101,risus semper porta volutpat quam pede lobortis ligula sit amet eleifend pede libero quis
102,curae nulla dapibus dolor vel est donec odio justo sollicitudin ut suscipit a feugiat et
103,rhoncus sed vestibulum sit amet cursus id turpis integer aliquet massa id lobortis convallis tortor risus
104,mi integer ac neque duis bibendum morbi non quam nec dui luctus rutrum nulla tellus in sagittis
105,tempus semper est quam pharetra magna ac consequat metus sapien ut nunc vestibulum ante ipsum primis in
106,sem fusce consequat nulla nisl nunc nisl duis bibendum felis sed interdum venenatis turpis enim blandit mi in porttitor pede
107,orci luctus et ultrices posuere cubilia curae nulla dapibus dolor vel est donec odio justo sollicitudin ut suscipit a feugiat
108,convallis tortor risus dapibus augue vel accumsan tellus nisi eu orci mauris lacinia sapien quis libero
109,neque duis bibendum morbi non quam nec dui luctus rutrum nulla tellus in sagittis dui vel
110,odio in hac habitasse platea dictumst maecenas ut massa quis augue luctus tincidunt nulla mollis molestie lorem quisque
111,varius ut blandit non interdum in ante vestibulum ante ipsum primis in faucibus orci luctus et
112,dolor morbi vel lectus in quam fringilla rhoncus mauris enim leo rhoncus sed vestibulum sit
113,velit id pretium iaculis diam erat fermentum justo nec condimentum neque sapien
114,aliquet at feugiat non pretium quis lectus suspendisse potenti in eleifend quam
115,at nibh in hac habitasse platea dictumst aliquam augue quam sollicitudin vitae consectetuer eget rutrum at lorem integer tincidunt
116,ultrices posuere cubilia curae nulla dapibus dolor vel est donec odio justo sollicitudin ut suscipit a feugiat et eros
117,justo aliquam quis turpis eget elit sodales scelerisque mauris sit amet eros suspendisse accumsan tortor quis turpis
118,ac nulla sed vel enim sit amet nunc viverra dapibus nulla suscipit ligula
119,cras pellentesque volutpat dui maecenas tristique est et tempus semper est quam
120,mi in porttitor pede justo eu massa donec dapibus duis at velit eu est congue elementum in hac habitasse
121,congue diam id ornare imperdiet sapien urna pretium nisl ut volutpat sapien arcu sed augue aliquam erat
122,pellentesque quisque porta volutpat erat quisque erat eros viverra eget congue eget semper rutrum nulla nunc purus phasellus
123,sapien varius ut blandit non interdum in ante vestibulum ante ipsum primis in faucibus orci
124,tortor risus dapibus augue vel accumsan tellus nisi eu orci mauris lacinia sapien quis
125,viverra pede ac diam cras pellentesque volutpat dui maecenas tristique est et tempus
126,vehicula consequat morbi a ipsum integer a nibh in quis justo maecenas rhoncus aliquam
127,sit amet justo morbi ut odio cras mi pede malesuada
128,in sapien iaculis congue vivamus metus arcu adipiscing molestie hendrerit at vulputate vitae nisl aenean
129,felis donec semper sapien a libero nam dui proin leo odio porttitor id consequat in consequat ut nulla sed
130,lectus suspendisse potenti in eleifend quam a odio in hac
131,quisque ut erat curabitur gravida nisi at nibh in hac habitasse platea dictumst
132,lobortis ligula sit amet eleifend pede libero quis orci nullam molestie nibh in lectus pellentesque at nulla suspendisse
133,sollicitudin ut suscipit a feugiat et eros vestibulum ac est lacinia nisi venenatis
134,purus phasellus in felis donec semper sapien a libero nam dui proin leo odio porttitor
135,convallis eget eleifend luctus ultricies eu nibh quisque id justo sit amet sapien
136,nulla mollis molestie lorem quisque ut erat curabitur gravida nisi at nibh
137,vestibulum eget vulputate ut ultrices vel augue vestibulum ante ipsum primis in faucibus orci luctus et ultrices
138,vivamus metus arcu adipiscing molestie hendrerit at vulputate vitae nisl aenean lectus pellentesque eget nunc donec quis orci
139,orci pede venenatis non sodales sed tincidunt eu felis fusce posuere felis sed lacus morbi sem mauris laoreet
140,ut dolor morbi vel lectus in quam fringilla rhoncus mauris enim
141,suspendisse potenti in eleifend quam a odio in hac habitasse platea dictumst maecenas ut massa
142,eget orci vehicula condimentum curabitur in libero ut massa volutpat convallis morbi odio odio
143,ante vivamus tortor duis mattis egestas metus aenean fermentum donec ut mauris eget massa tempor convallis nulla
144,ipsum ac tellus semper interdum mauris ullamcorper purus sit amet nulla quisque arcu libero rutrum ac lobortis vel
145,erat id mauris vulputate elementum nullam varius nulla facilisi cras non velit nec nisi vulputate nonummy maecenas tincidunt lacus
146,sapien non mi integer ac neque duis bibendum morbi non quam
147,nulla dapibus dolor vel est donec odio justo sollicitudin ut suscipit a
148,venenatis non sodales sed tincidunt eu felis fusce posuere felis
149,curae mauris viverra diam vitae quam suspendisse potenti nullam porttitor lacus at turpis donec posuere metus vitae ipsum aliquam non
150,nullam varius nulla facilisi cras non velit nec nisi vulputate nonummy maecenas tincidunt lacus at
151,at ipsum ac tellus semper interdum mauris ullamcorper purus sit amet nulla quisque arcu libero rutrum
152,commodo vulputate justo in blandit ultrices enim lorem ipsum dolor sit amet consectetuer adipiscing elit
153,nunc viverra dapibus nulla suscipit ligula in lacus curabitur at ipsum ac tellus semper interdum
154,augue a suscipit nulla elit ac nulla sed vel enim sit amet nunc viverra dapibus nulla suscipit ligula
155,cubilia curae nulla dapibus dolor vel est donec odio justo sollicitudin ut suscipit a feugiat et eros vestibulum
156,nullam sit amet turpis elementum ligula vehicula consequat morbi a ipsum integer a nibh in quis justo maecenas rhoncus aliquam
157,faucibus orci luctus et ultrices posuere cubilia curae donec pharetra magna vestibulum aliquet ultrices erat
158,curae donec pharetra magna vestibulum aliquet ultrices erat tortor sollicitudin mi sit amet lobortis sapien sapien non
159,turpis integer aliquet massa id lobortis convallis tortor risus dapibus augue
160,pede malesuada in imperdiet et commodo vulputate justo in blandit ultrices enim lorem ipsum dolor sit
161,interdum venenatis turpis enim blandit mi in porttitor pede justo eu massa donec dapibus
162,id luctus nec molestie sed justo pellentesque viverra pede ac diam cras pellentesque volutpat
163,ac diam cras pellentesque volutpat dui maecenas tristique est et tempus semper est quam pharetra magna ac consequat
164,augue quam sollicitudin vitae consectetuer eget rutrum at lorem integer tincidunt ante vel
165,sed nisl nunc rhoncus dui vel sem sed sagittis nam congue risus semper porta volutpat quam pede
166,sed accumsan felis ut at dolor quis odio consequat varius integer ac leo pellentesque ultrices mattis
167,mi integer ac neque duis bibendum morbi non quam nec dui luctus rutrum nulla tellus in sagittis
168,sem mauris laoreet ut rhoncus aliquet pulvinar sed nisl nunc rhoncus dui vel sem sed sagittis nam
169,turpis donec posuere metus vitae ipsum aliquam non mauris morbi non
170,sapien placerat ante nulla justo aliquam quis turpis eget elit sodales scelerisque mauris sit amet eros
171,id sapien in sapien iaculis congue vivamus metus arcu adipiscing molestie
172,non sodales sed tincidunt eu felis fusce posuere felis sed lacus morbi
173,adipiscing lorem vitae mattis nibh ligula nec sem duis aliquam convallis nunc proin at turpis a pede posuere
174,nec condimentum neque sapien placerat ante nulla justo aliquam quis turpis eget elit sodales scelerisque mauris
175,vestibulum ante ipsum primis in faucibus orci luctus et ultrices posuere cubilia
176,in tempor turpis nec euismod scelerisque quam turpis adipiscing lorem
177,viverra pede ac diam cras pellentesque volutpat dui maecenas tristique est et
178,phasellus in felis donec semper sapien a libero nam dui proin leo odio porttitor
179,nisl aenean lectus pellentesque eget nunc donec quis orci eget orci vehicula condimentum curabitur in libero
180,enim blandit mi in porttitor pede justo eu massa donec dapibus duis at velit eu est congue elementum in
181,nec nisi vulputate nonummy maecenas tincidunt lacus at velit vivamus vel nulla eget eros elementum pellentesque quisque porta volutpat
182,feugiat non pretium quis lectus suspendisse potenti in eleifend quam a odio in hac
183,auctor gravida sem praesent id massa id nisl venenatis lacinia
184,orci eget orci vehicula condimentum curabitur in libero ut massa volutpat convallis morbi odio
185,vestibulum rutrum rutrum neque aenean auctor gravida sem praesent id massa id
186,justo maecenas rhoncus aliquam lacus morbi quis tortor id nulla ultrices aliquet maecenas leo odio condimentum id
187,pharetra magna ac consequat metus sapien ut nunc vestibulum ante ipsum primis in faucibus orci luctus
188,condimentum curabitur in libero ut massa volutpat convallis morbi odio odio elementum eu interdum eu tincidunt in leo maecenas
189,nulla suspendisse potenti cras in purus eu magna vulputate luctus cum sociis natoque penatibus et magnis dis parturient montes nascetur
190,sapien iaculis congue vivamus metus arcu adipiscing molestie hendrerit at vulputate vitae
191,in libero ut massa volutpat convallis morbi odio odio elementum eu
192,enim blandit mi in porttitor pede justo eu massa donec dapibus duis at
193,vitae quam suspendisse potenti nullam porttitor lacus at turpis donec posuere metus vitae ipsum aliquam
194,consectetuer eget rutrum at lorem integer tincidunt ante vel ipsum praesent blandit
195,lacinia erat vestibulum sed magna at nunc commodo placerat praesent blandit nam nulla integer pede
196,ligula pellentesque ultrices phasellus id sapien in sapien iaculis congue vivamus metus arcu
197,nullam orci pede venenatis non sodales sed tincidunt eu felis fusce posuere
198,parturient montes nascetur ridiculus mus etiam vel augue vestibulum rutrum rutrum neque aenean auctor gravida sem praesent
199,platea dictumst morbi vestibulum velit id pretium iaculis diam erat fermentum justo nec condimentum neque sapien placerat ante nulla
200,aliquet maecenas leo odio condimentum id luctus nec molestie sed justo pellentesque viverra pede ac diam cras pellentesque
201,purus phasellus in felis donec semper sapien a libero nam dui proin
202,mauris viverra diam vitae quam suspendisse potenti nullam porttitor lacus at turpis donec
203,vitae quam suspendisse potenti nullam porttitor lacus at turpis donec posuere metus vitae ipsum
204,ipsum dolor sit amet consectetuer adipiscing elit proin risus praesent
205,habitasse platea dictumst etiam faucibus cursus urna ut tellus nulla ut erat
206,molestie nibh in lectus pellentesque at nulla suspendisse potenti cras in purus eu magna
207,in eleifend quam a odio in hac habitasse platea dictumst maecenas ut
208,convallis duis consequat dui nec nisi volutpat eleifend donec ut dolor
209,orci eget orci vehicula condimentum curabitur in libero ut massa
210,turpis adipiscing lorem vitae mattis nibh ligula nec sem duis aliquam convallis nunc
211,a odio in hac habitasse platea dictumst maecenas ut massa
212,diam in magna bibendum imperdiet nullam orci pede venenatis non sodales sed tincidunt eu felis fusce posuere felis sed
213,sociis natoque penatibus et magnis dis parturient montes nascetur ridiculus mus etiam vel augue vestibulum rutrum rutrum neque aenean
214,rutrum rutrum neque aenean auctor gravida sem praesent id massa id nisl venenatis lacinia aenean sit
215,morbi non lectus aliquam sit amet diam in magna bibendum imperdiet nullam
216,pede venenatis non sodales sed tincidunt eu felis fusce posuere felis sed lacus morbi sem
217,libero convallis eget eleifend luctus ultricies eu nibh quisque id justo sit amet sapien dignissim vestibulum
218,nec nisi volutpat eleifend donec ut dolor morbi vel lectus in quam fringilla rhoncus mauris enim leo rhoncus sed
219,orci nullam molestie nibh in lectus pellentesque at nulla suspendisse potenti cras in
220,mauris laoreet ut rhoncus aliquet pulvinar sed nisl nunc rhoncus dui vel sem sed sagittis nam congue risus semper porta
221,consequat varius integer ac leo pellentesque ultrices mattis odio donec vitae nisi nam ultrices libero non mattis
222,nibh in quis justo maecenas rhoncus aliquam lacus morbi quis tortor id nulla ultrices aliquet maecenas leo odio condimentum id
223,nec molestie sed justo pellentesque viverra pede ac diam cras pellentesque volutpat dui maecenas tristique est et tempus
224,ipsum praesent blandit lacinia erat vestibulum sed magna at nunc commodo
225,imperdiet et commodo vulputate justo in blandit ultrices enim lorem ipsum dolor sit amet consectetuer adipiscing elit proin
226,duis mattis egestas metus aenean fermentum donec ut mauris eget massa tempor convallis nulla neque libero
227,urna pretium nisl ut volutpat sapien arcu sed augue aliquam erat volutpat in congue
228,nibh in quis justo maecenas rhoncus aliquam lacus morbi quis tortor id nulla ultrices aliquet maecenas
229,quis orci eget orci vehicula condimentum curabitur in libero ut
230,nisl nunc nisl duis bibendum felis sed interdum venenatis turpis enim blandit mi
231,sapien quis libero nullam sit amet turpis elementum ligula vehicula consequat morbi a ipsum
232,quisque ut erat curabitur gravida nisi at nibh in hac habitasse platea dictumst aliquam augue quam sollicitudin
233,vitae consectetuer eget rutrum at lorem integer tincidunt ante vel ipsum praesent blandit lacinia erat vestibulum
234,iaculis diam erat fermentum justo nec condimentum neque sapien placerat ante nulla justo aliquam
235,magna vulputate luctus cum sociis natoque penatibus et magnis dis
236,praesent blandit nam nulla integer pede justo lacinia eget tincidunt eget tempus vel pede morbi porttitor lorem id ligula
237,condimentum curabitur in libero ut massa volutpat convallis morbi odio odio elementum eu interdum eu tincidunt in leo maecenas pulvinar
238,sapien cursus vestibulum proin eu mi nulla ac enim in tempor turpis nec euismod scelerisque quam turpis adipiscing lorem
239,morbi vel lectus in quam fringilla rhoncus mauris enim leo rhoncus sed vestibulum
240,ac neque duis bibendum morbi non quam nec dui luctus rutrum nulla tellus in sagittis dui vel nisl
241,nunc rhoncus dui vel sem sed sagittis nam congue risus semper porta volutpat
242,pellentesque at nulla suspendisse potenti cras in purus eu magna vulputate luctus
243,amet erat nulla tempus vivamus in felis eu sapien cursus vestibulum proin eu mi nulla ac enim in tempor turpis
244,vel ipsum praesent blandit lacinia erat vestibulum sed magna at nunc commodo
245,vel lectus in quam fringilla rhoncus mauris enim leo rhoncus sed vestibulum sit amet cursus id turpis integer
246,nonummy integer non velit donec diam neque vestibulum eget vulputate ut ultrices
247,faucibus accumsan odio curabitur convallis duis consequat dui nec nisi volutpat eleifend donec ut dolor morbi vel lectus in quam
248,fusce posuere felis sed lacus morbi sem mauris laoreet ut rhoncus aliquet pulvinar sed
249,erat vestibulum sed magna at nunc commodo placerat praesent blandit nam
250,neque sapien placerat ante nulla justo aliquam quis turpis eget elit sodales scelerisque mauris
251,diam in magna bibendum imperdiet nullam orci pede venenatis non sodales sed tincidunt eu felis
252,faucibus cursus urna ut tellus nulla ut erat id mauris
253,ultrices erat tortor sollicitudin mi sit amet lobortis sapien sapien
254,eget nunc donec quis orci eget orci vehicula condimentum curabitur in libero ut massa volutpat convallis morbi odio odio
255,suscipit ligula in lacus curabitur at ipsum ac tellus semper interdum mauris ullamcorper purus sit amet nulla quisque arcu libero
256,at nunc commodo placerat praesent blandit nam nulla integer pede
