foodbank_id,description
764,at nibh in hac habitasse platea dictumst aliquam augue quam sollicitudin vitae consectetuer eget rutrum at lorem integer tincidunt
765,quis justo maecenas rhoncus aliquam lacus morbi quis tortor id nulla
766,justo in hac habitasse platea dictumst etiam faucibus cursus urna ut tellus nulla ut erat id mauris
767,dui nec nisi volutpat eleifend donec ut dolor morbi vel lectus in quam fringilla
768,quis orci eget orci vehicula condimentum curabitur in libero ut massa volutpat convallis morbi odio odio elementum
769,faucibus accumsan odio curabitur convallis duis consequat dui nec nisi volutpat eleifend donec ut dolor
770,ante ipsum primis in faucibus orci luctus et ultrices posuere cubilia curae mauris viverra diam vitae quam suspendisse potenti
771,ligula suspendisse ornare consequat lectus in est risus auctor sed tristique in tempus sit amet sem fusce consequat nulla nisl
772,tortor quis turpis sed ante vivamus tortor duis mattis egestas metus
773,in quis justo maecenas rhoncus aliquam lacus morbi quis tortor
774,risus praesent lectus vestibulum quam sapien varius ut blandit non interdum in ante vestibulum
775,molestie hendrerit at vulputate vitae nisl aenean lectus pellentesque eget nunc donec
776,platea dictumst etiam faucibus cursus urna ut tellus nulla ut
777,luctus et ultrices posuere cubilia curae duis faucibus accumsan odio curabitur convallis duis consequat dui nec
778,aliquet at feugiat non pretium quis lectus suspendisse potenti in eleifend
779,tincidunt eget tempus vel pede morbi porttitor lorem id ligula suspendisse ornare consequat lectus in est risus auctor
780,in felis donec semper sapien a libero nam dui proin leo odio porttitor id consequat in consequat ut nulla
781,a pede posuere nonummy integer non velit donec diam neque vestibulum eget vulputate ut ultrices vel augue vestibulum ante
782,adipiscing lorem vitae mattis nibh ligula nec sem duis aliquam convallis
783,hac habitasse platea dictumst morbi vestibulum velit id pretium iaculis diam erat fermentum justo nec
784,faucibus orci luctus et ultrices posuere cubilia curae mauris viverra diam vitae quam suspendisse
785,justo maecenas rhoncus aliquam lacus morbi quis tortor id nulla ultrices aliquet maecenas leo odio condimentum
786,risus auctor sed tristique in tempus sit amet sem fusce consequat nulla nisl nunc nisl duis bibendum felis
787,in purus eu magna vulputate luctus cum sociis natoque penatibus et magnis dis parturient
788,tincidunt eu felis fusce posuere felis sed lacus morbi sem mauris laoreet ut rhoncus aliquet
789,nibh in lectus pellentesque at nulla suspendisse potenti cras in purus eu magna vulputate luctus cum sociis natoque penatibus et
790,in faucibus orci luctus et ultrices posuere cubilia curae duis faucibus accumsan odio curabitur convallis duis consequat dui
791,dapibus augue vel accumsan tellus nisi eu orci mauris lacinia sapien quis libero nullam sit amet turpis elementum
792,duis aliquam convallis nunc proin at turpis a pede posuere nonummy
793,sapien urna pretium nisl ut volutpat sapien arcu sed augue aliquam erat volutpat in congue etiam justo etiam
794,sed augue aliquam erat volutpat in congue etiam justo etiam pretium iaculis justo in hac habitasse platea dictumst
795,ullamcorper augue a suscipit nulla elit ac nulla sed vel
796,erat vestibulum sed magna at nunc commodo placerat praesent blandit nam nulla integer pede justo lacinia eget
797,tristique fusce congue diam id ornare imperdiet sapien urna pretium nisl ut volutpat sapien arcu sed augue aliquam erat volutpat
798,amet turpis elementum ligula vehicula consequat morbi a ipsum integer a nibh in
799,lacinia eget tincidunt eget tempus vel pede morbi porttitor lorem id ligula
800,in tempus sit amet sem fusce consequat nulla nisl nunc nisl duis bibendum felis sed interdum venenatis
801,nisi vulputate nonummy maecenas tincidunt lacus at velit vivamus vel nulla
802,rhoncus aliquam lacus morbi quis tortor id nulla ultrices aliquet maecenas leo odio condimentum
803,volutpat quam pede lobortis ligula sit amet eleifend pede libero quis orci nullam molestie nibh
804,proin eu mi nulla ac enim in tempor turpis nec euismod scelerisque quam
805,eu felis fusce posuere felis sed lacus morbi sem mauris laoreet ut rhoncus aliquet
806,at turpis donec posuere metus vitae ipsum aliquam non mauris morbi non lectus aliquam sit amet diam
807,elementum ligula vehicula consequat morbi a ipsum integer a nibh
808,cursus urna ut tellus nulla ut erat id mauris vulputate elementum nullam varius nulla facilisi cras non velit
809,neque libero convallis eget eleifend luctus ultricies eu nibh quisque id justo sit amet sapien
810,elementum eu interdum eu tincidunt in leo maecenas pulvinar lobortis est phasellus sit amet erat nulla tempus
811,lacus morbi sem mauris laoreet ut rhoncus aliquet pulvinar sed nisl nunc
812,quis augue luctus tincidunt nulla mollis molestie lorem quisque ut erat curabitur gravida nisi at
813,vel enim sit amet nunc viverra dapibus nulla suscipit ligula in lacus curabitur
814,donec dapibus duis at velit eu est congue elementum in hac
815,amet sem fusce consequat nulla nisl nunc nisl duis bibendum
816,sed lacus morbi sem mauris laoreet ut rhoncus aliquet pulvinar sed nisl nunc rhoncus dui vel sem
817,praesent id massa id nisl venenatis lacinia aenean sit amet justo morbi ut odio cras
818,vivamus metus arcu adipiscing molestie hendrerit at vulputate vitae nisl aenean lectus pellentesque eget nunc donec quis orci eget
819,dolor quis odio consequat varius integer ac leo pellentesque ultrices mattis odio donec vitae nisi
820,rhoncus aliquam lacus morbi quis tortor id nulla ultrices aliquet maecenas leo odio condimentum id luctus nec molestie sed
821,consequat in consequat ut nulla sed accumsan felis ut at dolor
822,rutrum neque aenean auctor gravida sem praesent id massa id nisl venenatis lacinia aenean sit amet
823,diam cras pellentesque volutpat dui maecenas tristique est et tempus semper est quam pharetra magna ac consequat metus sapien
824,nibh ligula nec sem duis aliquam convallis nunc proin at turpis a pede posuere nonummy
825,lectus in est risus auctor sed tristique in tempus sit amet
826,consequat ut nulla sed accumsan felis ut at dolor quis odio consequat varius integer ac leo pellentesque ultrices mattis
827,neque duis bibendum morbi non quam nec dui luctus rutrum nulla tellus in sagittis dui vel nisl duis ac nibh
828,vestibulum ac est lacinia nisi venenatis tristique fusce congue diam id ornare imperdiet
829,vivamus in felis eu sapien cursus vestibulum proin eu mi nulla ac enim
830,sapien urna pretium nisl ut volutpat sapien arcu sed augue aliquam erat volutpat in congue etiam justo
831,eros suspendisse accumsan tortor quis turpis sed ante vivamus tortor duis
832,tincidunt nulla mollis molestie lorem quisque ut erat curabitur gravida nisi at nibh in hac habitasse
833,orci luctus et ultrices posuere cubilia curae donec pharetra magna
834,amet erat nulla tempus vivamus in felis eu sapien cursus vestibulum proin eu mi nulla ac enim in tempor turpis
835,vestibulum sit amet cursus id turpis integer aliquet massa id
836,non mi integer ac neque duis bibendum morbi non quam nec dui luctus rutrum nulla tellus in
837,nonummy integer non velit donec diam neque vestibulum eget vulputate ut ultrices vel augue vestibulum ante ipsum
838,integer pede justo lacinia eget tincidunt eget tempus vel pede morbi porttitor lorem id ligula
839,mauris laoreet ut rhoncus aliquet pulvinar sed nisl nunc rhoncus dui vel sem sed sagittis nam congue risus semper
840,mattis odio donec vitae nisi nam ultrices libero non mattis
841,vehicula condimentum curabitur in libero ut massa volutpat convallis morbi odio odio elementum eu interdum eu tincidunt
842,sodales scelerisque mauris sit amet eros suspendisse accumsan tortor quis turpis sed ante vivamus tortor
843,eros elementum pellentesque quisque porta volutpat erat quisque erat eros viverra eget congue eget semper rutrum nulla nunc purus phasellus
844,orci luctus et ultrices posuere cubilia curae duis faucibus accumsan odio curabitur convallis
845,erat tortor sollicitudin mi sit amet lobortis sapien sapien non mi integer ac
846,bibendum morbi non quam nec dui luctus rutrum nulla tellus in sagittis dui vel nisl duis
847,quam turpis adipiscing lorem vitae mattis nibh ligula nec sem duis aliquam convallis nunc proin at turpis a
848,felis eu sapien cursus vestibulum proin eu mi nulla ac enim in tempor turpis nec euismod scelerisque quam turpis adipiscing
849,sit amet turpis elementum ligula vehicula consequat morbi a ipsum integer a nibh in quis justo
850,est congue elementum in hac habitasse platea dictumst morbi vestibulum velit id
851,curabitur convallis duis consequat dui nec nisi volutpat eleifend donec
852,sollicitudin vitae consectetuer eget rutrum at lorem integer tincidunt ante vel ipsum
853,fermentum justo nec condimentum neque sapien placerat ante nulla justo aliquam quis turpis eget elit sodales scelerisque mauris sit
854,nisi venenatis tristique fusce congue diam id ornare imperdiet sapien urna pretium nisl ut volutpat sapien arcu
855,sed lacus morbi sem mauris laoreet ut rhoncus aliquet pulvinar sed nisl nunc rhoncus dui
856,blandit mi in porttitor pede justo eu massa donec dapibus duis at
857,sapien ut nunc vestibulum ante ipsum primis in faucibus orci luctus et ultrices posuere cubilia curae
858,dolor sit amet consectetuer adipiscing elit proin interdum mauris non ligula pellentesque ultrices phasellus id sapien
859,augue vel accumsan tellus nisi eu orci mauris lacinia sapien quis libero nullam sit amet turpis elementum ligula vehicula
860,pede venenatis non sodales sed tincidunt eu felis fusce posuere felis
861,lorem vitae mattis nibh ligula nec sem duis aliquam convallis nunc proin
862,arcu adipiscing molestie hendrerit at vulputate vitae nisl aenean lectus pellentesque eget nunc donec quis
863,quis tortor id nulla ultrices aliquet maecenas leo odio condimentum id
864,donec odio justo sollicitudin ut suscipit a feugiat et eros vestibulum ac est lacinia
865,est donec odio justo sollicitudin ut suscipit a feugiat et eros vestibulum ac est lacinia nisi venenatis tristique fusce congue
866,mattis egestas metus aenean fermentum donec ut mauris eget massa tempor convallis nulla neque libero convallis eget eleifend luctus
867,ipsum primis in faucibus orci luctus et ultrices posuere cubilia curae nulla
868,magna vulputate luctus cum sociis natoque penatibus et magnis dis parturient montes nascetur ridiculus
869,dolor sit amet consectetuer adipiscing elit proin risus praesent lectus vestibulum quam sapien varius ut blandit non interdum
870,enim blandit mi in porttitor pede justo eu massa donec dapibus
871,lectus aliquam sit amet diam in magna bibendum imperdiet nullam orci
872,erat curabitur gravida nisi at nibh in hac habitasse platea dictumst
873,curae nulla dapibus dolor vel est donec odio justo sollicitudin ut suscipit a feugiat et eros vestibulum
874,viverra pede ac diam cras pellentesque volutpat dui maecenas tristique
875,amet sapien dignissim vestibulum vestibulum ante ipsum primis in faucibus orci luctus et
876,nulla facilisi cras non velit nec nisi vulputate nonummy maecenas tincidunt
877,morbi non quam nec dui luctus rutrum nulla tellus in sagittis dui vel
878,aenean sit amet justo morbi ut odio cras mi pede malesuada in
879,morbi quis tortor id nulla ultrices aliquet maecenas leo odio condimentum id luctus nec molestie sed
880,adipiscing elit proin risus praesent lectus vestibulum quam sapien varius ut blandit non interdum
881,vivamus metus arcu adipiscing molestie hendrerit at vulputate vitae nisl aenean lectus pellentesque eget nunc donec
882,ultricies eu nibh quisque id justo sit amet sapien dignissim vestibulum vestibulum ante ipsum primis in faucibus orci luctus et
883,cubilia curae duis faucibus accumsan odio curabitur convallis duis consequat dui nec nisi volutpat eleifend donec ut dolor morbi
884,dapibus augue vel accumsan tellus nisi eu orci mauris lacinia sapien quis libero nullam
885,vulputate ut ultrices vel augue vestibulum ante ipsum primis in faucibus orci luctus et ultrices posuere cubilia curae
886,vestibulum sagittis sapien cum sociis natoque penatibus et magnis dis parturient montes nascetur ridiculus mus etiam
887,luctus tincidunt nulla mollis molestie lorem quisque ut erat curabitur gravida nisi
888,amet consectetuer adipiscing elit proin risus praesent lectus vestibulum quam sapien varius ut blandit non interdum in ante
889,parturient montes nascetur ridiculus mus etiam vel augue vestibulum rutrum rutrum neque aenean auctor
890,felis eu sapien cursus vestibulum proin eu mi nulla ac enim in tempor turpis nec euismod
891,duis consequat dui nec nisi volutpat eleifend donec ut dolor morbi vel lectus
892,luctus ultricies eu nibh quisque id justo sit amet sapien dignissim vestibulum vestibulum ante ipsum primis in faucibus orci
893,porttitor pede justo eu massa donec dapibus duis at velit eu est congue elementum in hac habitasse platea dictumst morbi
894,ut massa volutpat convallis morbi odio odio elementum eu interdum eu tincidunt in leo maecenas pulvinar lobortis
895,sit amet eros suspendisse accumsan tortor quis turpis sed ante vivamus tortor duis mattis egestas metus aenean fermentum donec
896,sit amet diam in magna bibendum imperdiet nullam orci pede venenatis non sodales sed tincidunt eu
897,enim sit amet nunc viverra dapibus nulla suscipit ligula in lacus curabitur at ipsum ac
898,nisl nunc nisl duis bibendum felis sed interdum venenatis turpis
899,lobortis convallis tortor risus dapibus augue vel accumsan tellus nisi
900,blandit lacinia erat vestibulum sed magna at nunc commodo placerat praesent blandit
901,ipsum ac tellus semper interdum mauris ullamcorper purus sit amet
902,ultrices mattis odio donec vitae nisi nam ultrices libero non mattis pulvinar nulla pede ullamcorper augue a suscipit nulla
903,suscipit ligula in lacus curabitur at ipsum ac tellus semper interdum mauris ullamcorper purus sit
904,elementum pellentesque quisque porta volutpat erat quisque erat eros viverra
905,nunc purus phasellus in felis donec semper sapien a libero nam dui proin leo odio porttitor id
906,eu interdum eu tincidunt in leo maecenas pulvinar lobortis est phasellus sit amet
907,nulla facilisi cras non velit nec nisi vulputate nonummy maecenas tincidunt lacus at velit vivamus vel nulla eget eros elementum
908,ligula pellentesque ultrices phasellus id sapien in sapien iaculis congue vivamus metus arcu adipiscing molestie hendrerit at vulputate vitae
909,a ipsum integer a nibh in quis justo maecenas rhoncus aliquam
910,orci eget orci vehicula condimentum curabitur in libero ut massa volutpat convallis morbi odio odio
911,cubilia curae duis faucibus accumsan odio curabitur convallis duis consequat dui nec nisi volutpat eleifend donec ut dolor morbi vel
912,sagittis sapien cum sociis natoque penatibus et magnis dis parturient montes nascetur ridiculus
913,est congue elementum in hac habitasse platea dictumst morbi vestibulum velit id pretium iaculis diam erat fermentum justo nec
914,nulla tempus vivamus in felis eu sapien cursus vestibulum proin eu mi nulla ac enim in tempor
915,quis tortor id nulla ultrices aliquet maecenas leo odio condimentum id luctus nec molestie sed
916,eget tincidunt eget tempus vel pede morbi porttitor lorem id
917,erat volutpat in congue etiam justo etiam pretium iaculis justo in
918,nec nisi volutpat eleifend donec ut dolor morbi vel lectus in quam fringilla
919,et ultrices posuere cubilia curae donec pharetra magna vestibulum aliquet ultrices erat tortor sollicitudin mi sit amet lobortis sapien
920,vel lectus in quam fringilla rhoncus mauris enim leo rhoncus sed vestibulum sit amet cursus
921,sit amet cursus id turpis integer aliquet massa id lobortis convallis tortor risus dapibus augue vel accumsan tellus
922,nulla tellus in sagittis dui vel nisl duis ac nibh fusce lacus
923,dolor vel est donec odio justo sollicitudin ut suscipit a feugiat et eros vestibulum
924,convallis nulla neque libero convallis eget eleifend luctus ultricies eu nibh quisque id justo sit amet sapien dignissim vestibulum vestibulum
925,ut blandit non interdum in ante vestibulum ante ipsum primis in faucibus orci
926,sem duis aliquam convallis nunc proin at turpis a pede posuere
927,ac neque duis bibendum morbi non quam nec dui luctus rutrum nulla tellus in sagittis
928,rutrum rutrum neque aenean auctor gravida sem praesent id massa id nisl venenatis lacinia aenean sit amet justo
929,condimentum id luctus nec molestie sed justo pellentesque viverra pede ac diam cras pellentesque volutpat dui maecenas tristique
930,eu magna vulputate luctus cum sociis natoque penatibus et magnis dis parturient montes nascetur ridiculus mus vivamus vestibulum sagittis sapien
931,pede malesuada in imperdiet et commodo vulputate justo in blandit ultrices enim lorem ipsum dolor
932,ac neque duis bibendum morbi non quam nec dui luctus rutrum nulla tellus in sagittis dui vel nisl duis ac
933,phasellus sit amet erat nulla tempus vivamus in felis eu sapien cursus vestibulum proin eu mi nulla
934,mi nulla ac enim in tempor turpis nec euismod scelerisque quam turpis adipiscing lorem vitae mattis nibh
935,odio in hac habitasse platea dictumst maecenas ut massa quis augue luctus tincidunt nulla mollis molestie lorem
936,lobortis vel dapibus at diam nam tristique tortor eu pede
937,pede malesuada in imperdiet et commodo vulputate justo in blandit ultrices enim
938,nulla facilisi cras non velit nec nisi vulputate nonummy maecenas tincidunt lacus at velit vivamus vel nulla eget eros elementum
939,libero non mattis pulvinar nulla pede ullamcorper augue a suscipit nulla elit ac nulla sed vel
940,vestibulum ac est lacinia nisi venenatis tristique fusce congue diam
941,molestie hendrerit at vulputate vitae nisl aenean lectus pellentesque eget nunc donec quis orci eget orci
942,vivamus in felis eu sapien cursus vestibulum proin eu mi nulla
943,feugiat et eros vestibulum ac est lacinia nisi venenatis tristique fusce congue diam
944,magnis dis parturient montes nascetur ridiculus mus vivamus vestibulum sagittis sapien cum sociis natoque penatibus et magnis dis
945,morbi non lectus aliquam sit amet diam in magna bibendum imperdiet nullam orci pede venenatis non sodales sed
946,congue eget semper rutrum nulla nunc purus phasellus in felis donec semper sapien a libero nam dui
947,ut mauris eget massa tempor convallis nulla neque libero convallis eget eleifend luctus ultricies eu nibh quisque
948,mauris eget massa tempor convallis nulla neque libero convallis eget eleifend luctus ultricies eu nibh quisque id justo
949,mauris lacinia sapien quis libero nullam sit amet turpis elementum ligula vehicula consequat morbi
950,quis libero nullam sit amet turpis elementum ligula vehicula consequat morbi a ipsum integer a nibh in
951,tincidunt nulla mollis molestie lorem quisque ut erat curabitur gravida nisi at
952,eget nunc donec quis orci eget orci vehicula condimentum curabitur in libero ut massa
953,rhoncus sed vestibulum sit amet cursus id turpis integer aliquet massa id lobortis convallis tortor risus
954,amet lobortis sapien sapien non mi integer ac neque duis bibendum morbi non quam nec dui luctus rutrum nulla
955,semper rutrum nulla nunc purus phasellus in felis donec semper sapien a libero nam dui
956,aliquam augue quam sollicitudin vitae consectetuer eget rutrum at lorem integer
957,in quam fringilla rhoncus mauris enim leo rhoncus sed vestibulum sit amet cursus id
958,platea dictumst maecenas ut massa quis augue luctus tincidunt nulla mollis molestie lorem quisque
959,scelerisque mauris sit amet eros suspendisse accumsan tortor quis turpis sed ante vivamus tortor duis mattis egestas metus aenean
960,montes nascetur ridiculus mus vivamus vestibulum sagittis sapien cum sociis natoque penatibus et magnis dis parturient montes nascetur
961,eget vulputate ut ultrices vel augue vestibulum ante ipsum primis in faucibus orci luctus et ultrices
962,feugiat et eros vestibulum ac est lacinia nisi venenatis tristique fusce
963,vehicula condimentum curabitur in libero ut massa volutpat convallis morbi odio odio elementum
964,ipsum ac tellus semper interdum mauris ullamcorper purus sit amet nulla quisque arcu
965,ipsum primis in faucibus orci luctus et ultrices posuere cubilia curae nulla dapibus dolor vel est donec odio justo sollicitudin
966,turpis integer aliquet massa id lobortis convallis tortor risus dapibus augue vel accumsan tellus
967,erat quisque erat eros viverra eget congue eget semper rutrum nulla nunc purus phasellus in felis
968,est congue elementum in hac habitasse platea dictumst morbi vestibulum velit id pretium iaculis diam erat
969,orci eget orci vehicula condimentum curabitur in libero ut massa volutpat convallis
970,elit proin risus praesent lectus vestibulum quam sapien varius ut blandit non interdum in
971,sapien cum sociis natoque penatibus et magnis dis parturient montes nascetur
972,vivamus tortor duis mattis egestas metus aenean fermentum donec ut mauris eget
973,bibendum felis sed interdum venenatis turpis enim blandit mi in porttitor pede justo eu massa donec
974,tempus sit amet sem fusce consequat nulla nisl nunc nisl duis
975,ipsum aliquam non mauris morbi non lectus aliquam sit amet diam in magna bibendum
976,sed vel enim sit amet nunc viverra dapibus nulla suscipit ligula in lacus curabitur
977,lectus in est risus auctor sed tristique in tempus sit amet
978,mauris ullamcorper purus sit amet nulla quisque arcu libero rutrum ac lobortis
979,ac enim in tempor turpis nec euismod scelerisque quam turpis adipiscing lorem vitae
980,odio in hac habitasse platea dictumst maecenas ut massa quis
981,rhoncus sed vestibulum sit amet cursus id turpis integer aliquet massa id lobortis convallis
982,posuere cubilia curae duis faucibus accumsan odio curabitur convallis duis consequat dui nec nisi
983,consequat morbi a ipsum integer a nibh in quis justo maecenas rhoncus aliquam lacus morbi quis tortor id nulla ultrices
984,dapibus nulla suscipit ligula in lacus curabitur at ipsum ac tellus semper interdum mauris
985,mauris lacinia sapien quis libero nullam sit amet turpis elementum ligula vehicula consequat morbi a ipsum
986,leo maecenas pulvinar lobortis est phasellus sit amet erat nulla tempus vivamus in felis eu sapien cursus
987,aenean auctor gravida sem praesent id massa id nisl venenatis lacinia
988,ut tellus nulla ut erat id mauris vulputate elementum nullam varius nulla facilisi
989,tempor convallis nulla neque libero convallis eget eleifend luctus ultricies eu nibh quisque id justo sit amet sapien
990,quam nec dui luctus rutrum nulla tellus in sagittis dui vel nisl duis
991,fusce posuere felis sed lacus morbi sem mauris laoreet ut rhoncus aliquet
992,rutrum neque aenean auctor gravida sem praesent id massa id nisl venenatis lacinia aenean sit
993,justo lacinia eget tincidunt eget tempus vel pede morbi porttitor
994,quisque id justo sit amet sapien dignissim vestibulum vestibulum ante ipsum primis in faucibus orci luctus et ultrices
995,dui luctus rutrum nulla tellus in sagittis dui vel nisl duis ac nibh fusce lacus purus aliquet at
996,nisl duis bibendum felis sed interdum venenatis turpis enim blandit mi in porttitor pede justo
997,ultrices posuere cubilia curae nulla dapibus dolor vel est donec odio justo sollicitudin
998,tellus in sagittis dui vel nisl duis ac nibh fusce lacus purus aliquet at
999,duis bibendum morbi non quam nec dui luctus rutrum nulla tellus in sagittis dui vel
1000,nibh in quis justo maecenas rhoncus aliquam lacus morbi quis