foodbank_id,description
257,nulla nisl nunc nisl duis bibendum felis sed interdum venenatis turpis enim blandit mi
258,pellentesque quisque porta volutpat erat quisque erat eros viverra eget congue eget
259,habitasse platea dictumst maecenas ut massa quis augue luctus tincidunt nulla mollis molestie
260,quis libero nullam sit amet turpis elementum ligula vehicula consequat morbi a ipsum integer a nibh in quis
261,donec dapibus duis at velit eu est congue elementum in
262,in tempus sit amet sem fusce consequat nulla nisl nunc nisl duis bibendum felis sed interdum
263,pede justo eu massa donec dapibus duis at velit eu est congue elementum in hac habitasse platea
264,id luctus nec molestie sed justo pellentesque viverra pede ac diam cras pellentesque volutpat dui maecenas tristique est et tempus
265,dapibus augue vel accumsan tellus nisi eu orci mauris lacinia sapien quis libero nullam sit amet
266,rhoncus aliquam lacus morbi quis tortor id nulla ultrices aliquet maecenas leo odio condimentum
267,magna at nunc commodo placerat praesent blandit nam nulla integer pede justo lacinia eget tincidunt eget tempus vel
268,ornare imperdiet sapien urna pretium nisl ut volutpat sapien arcu sed augue aliquam erat volutpat
269,primis in faucibus orci luctus et ultrices posuere cubilia curae nulla dapibus dolor vel est donec odio justo sollicitudin
270,quisque id justo sit amet sapien dignissim vestibulum vestibulum ante ipsum primis in faucibus orci luctus et ultrices posuere cubilia
271,morbi non quam nec dui luctus rutrum nulla tellus in sagittis
272,leo maecenas pulvinar lobortis est phasellus sit amet erat nulla tempus vivamus in felis eu
273,habitasse platea dictumst etiam faucibus cursus urna ut tellus nulla ut erat id mauris
274,in porttitor pede justo eu massa donec dapibus duis at velit eu est congue elementum
275,congue etiam justo etiam pretium iaculis justo in hac habitasse platea dictumst
276,nisl aenean lectus pellentesque eget nunc donec quis orci eget
277,commodo placerat praesent blandit nam nulla integer pede justo lacinia eget tincidunt eget tempus vel
278,condimentum curabitur in libero ut massa volutpat convallis morbi odio odio elementum eu interdum eu tincidunt
279,accumsan tellus nisi eu orci mauris lacinia sapien quis libero nullam sit amet turpis elementum ligula vehicula consequat morbi a
280,placerat ante nulla justo aliquam quis turpis eget elit sodales scelerisque
281,bibendum felis sed interdum venenatis turpis enim blandit mi in porttitor pede justo eu
282,in libero ut massa volutpat convallis morbi odio odio elementum
283,placerat ante nulla justo aliquam quis turpis eget elit sodales
284,suspendisse accumsan tortor quis turpis sed ante vivamus tortor duis mattis egestas metus aenean fermentum
285,sollicitudin mi sit amet lobortis sapien sapien non mi integer ac neque duis bibendum morbi non quam nec dui
286,ut odio cras mi pede malesuada in imperdiet et commodo vulputate justo in blandit ultrices enim lorem ipsum dolor sit
287,pulvinar sed nisl nunc rhoncus dui vel sem sed sagittis nam congue risus semper porta volutpat quam pede lobortis ligula
288,hendrerit at vulputate vitae nisl aenean lectus pellentesque eget nunc donec quis orci eget orci vehicula condimentum
289,lectus in quam fringilla rhoncus mauris enim leo rhoncus sed vestibulum sit amet cursus id turpis
290,convallis morbi odio odio elementum eu interdum eu tincidunt in leo maecenas pulvinar lobortis est phasellus sit amet
291,porttitor id consequat in consequat ut nulla sed accumsan felis ut at dolor quis odio consequat varius integer ac leo
292,adipiscing elit proin interdum mauris non ligula pellentesque ultrices phasellus id sapien in sapien
293,morbi non quam nec dui luctus rutrum nulla tellus in sagittis dui vel nisl duis ac nibh fusce
294,turpis integer aliquet massa id lobortis convallis tortor risus dapibus
295,et magnis dis parturient montes nascetur ridiculus mus etiam vel augue vestibulum rutrum rutrum neque aenean auctor gravida sem praesent
296,metus aenean fermentum donec ut mauris eget massa tempor convallis
297,non velit donec diam neque vestibulum eget vulputate ut ultrices vel augue vestibulum ante ipsum primis in faucibus
298,pretium iaculis diam erat fermentum justo nec condimentum neque sapien placerat ante nulla justo
299,eleifend quam a odio in hac habitasse platea dictumst maecenas ut massa
300,in purus eu magna vulputate luctus cum sociis natoque penatibus et magnis dis parturient montes nascetur ridiculus mus vivamus vestibulum
301,suscipit a feugiat et eros vestibulum ac est lacinia nisi venenatis tristique
302,pellentesque at nulla suspendisse potenti cras in purus eu magna vulputate
303,potenti in eleifend quam a odio in hac habitasse platea dictumst maecenas ut massa quis augue
304,vestibulum sit amet cursus id turpis integer aliquet massa id lobortis convallis tortor risus dapibus augue
305,quam sapien varius ut blandit non interdum in ante vestibulum ante ipsum primis in faucibus orci
306,interdum mauris ullamcorper purus sit amet nulla quisque arcu libero rutrum ac lobortis vel
307,vivamus vestibulum sagittis sapien cum sociis natoque penatibus et magnis
308,erat volutpat in congue etiam justo etiam pretium iaculis justo in hac habitasse platea dictumst etiam
309,pede libero quis orci nullam molestie nibh in lectus pellentesque at nulla suspendisse potenti cras in
310,fusce lacus purus aliquet at feugiat non pretium quis lectus suspendisse potenti in eleifend quam a odio in hac habitasse
311,elementum in hac habitasse platea dictumst morbi vestibulum velit id pretium iaculis
312,orci vehicula condimentum curabitur in libero ut massa volutpat convallis morbi odio odio elementum eu interdum eu
313,sagittis dui vel nisl duis ac nibh fusce lacus purus aliquet at feugiat
314,aliquet massa id lobortis convallis tortor risus dapibus augue vel accumsan tellus nisi eu orci mauris lacinia sapien quis
315,vestibulum eget vulputate ut ultrices vel augue vestibulum ante ipsum primis in
316,magna vulputate luctus cum sociis natoque penatibus et magnis dis parturient montes nascetur ridiculus mus vivamus vestibulum
317,nascetur ridiculus mus vivamus vestibulum sagittis sapien cum sociis natoque penatibus et magnis dis parturient montes nascetur ridiculus mus etiam
318,adipiscing elit proin risus praesent lectus vestibulum quam sapien varius ut blandit non interdum in ante vestibulum
319,primis in faucibus orci luctus et ultrices posuere cubilia curae duis faucibus accumsan odio
320,nisl nunc nisl duis bibendum felis sed interdum venenatis turpis enim blandit mi in porttitor pede justo eu
321,blandit nam nulla integer pede justo lacinia eget tincidunt eget tempus vel pede morbi porttitor lorem
322,vestibulum eget vulputate ut ultrices vel augue vestibulum ante ipsum primis in faucibus orci luctus et ultrices posuere cubilia
323,orci nullam molestie nibh in lectus pellentesque at nulla suspendisse
324,integer tincidunt ante vel ipsum praesent blandit lacinia erat vestibulum sed magna at nunc commodo placerat praesent blandit nam
325,nulla justo aliquam quis turpis eget elit sodales scelerisque mauris sit amet
326,eu est congue elementum in hac habitasse platea dictumst morbi vestibulum velit id pretium iaculis diam erat fermentum
327,est quam pharetra magna ac consequat metus sapien ut nunc vestibulum ante ipsum primis in
328,eget elit sodales scelerisque mauris sit amet eros suspendisse accumsan tortor quis turpis sed
329,luctus rutrum nulla tellus in sagittis dui vel nisl duis ac nibh fusce lacus purus aliquet at feugiat non pretium
330,rhoncus aliquam lacus morbi quis tortor id nulla ultrices aliquet maecenas leo odio condimentum id
331,vestibulum eget vulputate ut ultrices vel augue vestibulum ante ipsum primis in faucibus orci
332,lacinia sapien quis libero nullam sit amet turpis elementum ligula vehicula consequat
333,dolor sit amet consectetuer adipiscing elit proin risus praesent lectus
334,venenatis turpis enim blandit mi in porttitor pede justo eu massa donec dapibus duis at velit eu est congue elementum
335,id mauris vulputate elementum nullam varius nulla facilisi cras non velit nec
336,eleifend donec ut dolor morbi vel lectus in quam fringilla rhoncus mauris enim leo rhoncus sed vestibulum sit amet
337,volutpat erat quisque erat eros viverra eget congue eget semper
338,habitasse platea dictumst morbi vestibulum velit id pretium iaculis diam erat fermentum justo nec
339,pede ac diam cras pellentesque volutpat dui maecenas tristique est et
340,id consequat in consequat ut nulla sed accumsan felis ut at dolor quis odio consequat varius integer ac
341,in felis donec semper sapien a libero nam dui proin leo odio porttitor id consequat in
342,maecenas ut massa quis augue luctus tincidunt nulla mollis molestie lorem quisque ut erat
343,erat id mauris vulputate elementum nullam varius nulla facilisi cras non velit nec nisi vulputate nonummy maecenas tincidunt lacus
344,imperdiet sapien urna pretium nisl ut volutpat sapien arcu sed augue aliquam erat volutpat in congue
345,neque duis bibendum morbi non quam nec dui luctus rutrum
346,amet eleifend pede libero quis orci nullam molestie nibh in lectus pellentesque at
347,tellus nulla ut erat id mauris vulputate elementum nullam varius nulla facilisi cras non velit nec nisi vulputate
348,sit amet sem fusce consequat nulla nisl nunc nisl duis bibendum felis sed interdum venenatis turpis enim blandit mi
349,sapien a libero nam dui proin leo odio porttitor id consequat in consequat ut nulla sed
350,lacus morbi quis tortor id nulla ultrices aliquet maecenas leo odio condimentum id luctus
351,fusce congue diam id ornare imperdiet sapien urna pretium nisl ut volutpat sapien arcu sed augue
352,donec semper sapien a libero nam dui proin leo odio porttitor id consequat in consequat
353,in eleifend quam a odio in hac habitasse platea dictumst maecenas ut massa quis augue
354,purus aliquet at feugiat non pretium quis lectus suspendisse potenti in eleifend quam a
355,neque sapien placerat ante nulla justo aliquam quis turpis eget elit sodales scelerisque mauris
356,id nulla ultrices aliquet maecenas leo odio condimentum id luctus nec
357,at velit eu est congue elementum in hac habitasse platea dictumst morbi vestibulum velit id pretium iaculis diam
358,vel augue vestibulum rutrum rutrum neque aenean auctor gravida sem praesent id massa
359,eros viverra eget congue eget semper rutrum nulla nunc purus phasellus
360,nulla quisque arcu libero rutrum ac lobortis vel dapibus at diam nam tristique tortor
361,volutpat erat quisque erat eros viverra eget congue eget semper rutrum nulla
362,non mi integer ac neque duis bibendum morbi non quam nec dui luctus rutrum nulla tellus in sagittis dui vel
363,luctus et ultrices posuere cubilia curae donec pharetra magna vestibulum aliquet ultrices erat
364,augue luctus tincidunt nulla mollis molestie lorem quisque ut erat curabitur gravida nisi at nibh in hac habitasse
365,blandit mi in porttitor pede justo eu massa donec dapibus duis at velit eu est congue elementum in hac habitasse
366,platea dictumst aliquam augue quam sollicitudin vitae consectetuer eget rutrum at lorem integer tincidunt ante vel ipsum praesent blandit
367,odio justo sollicitudin ut suscipit a feugiat et eros vestibulum ac est lacinia nisi venenatis tristique fusce congue diam id
368,sapien urna pretium nisl ut volutpat sapien arcu sed augue aliquam
369,ultrices vel augue vestibulum ante ipsum primis in faucibus orci luctus
370,commodo vulputate justo in blandit ultrices enim lorem ipsum dolor sit
371,amet sapien dignissim vestibulum vestibulum ante ipsum primis in faucibus orci luctus et ultrices posuere cubilia curae nulla dapibus
372,nulla nisl nunc nisl duis bibendum felis sed interdum venenatis turpis enim
373,maecenas ut massa quis augue luctus tincidunt nulla mollis molestie
374,in sapien iaculis congue vivamus metus arcu adipiscing molestie hendrerit at vulputate vitae nisl aenean lectus pellentesque eget
375,nulla ultrices aliquet maecenas leo odio condimentum id luctus nec molestie sed justo
376,vel augue vestibulum rutrum rutrum neque aenean auctor gravida sem praesent id massa id
377,libero non mattis pulvinar nulla pede ullamcorper augue a suscipit nulla elit ac nulla sed vel enim sit amet
378,dui vel sem sed sagittis nam congue risus semper porta volutpat quam pede lobortis ligula sit amet
379,sapien a libero nam dui proin leo odio porttitor id consequat in consequat ut nulla sed accumsan felis
380,turpis adipiscing lorem vitae mattis nibh ligula nec sem duis aliquam convallis nunc proin at turpis
381,non interdum in ante vestibulum ante ipsum primis in faucibus orci luctus et
382,nam nulla integer pede justo lacinia eget tincidunt eget tempus vel
383,odio consequat varius integer ac leo pellentesque ultrices mattis odio donec vitae nisi nam ultrices libero non
384,dictumst morbi vestibulum velit id pretium iaculis diam erat fermentum justo nec condimentum
385,risus praesent lectus vestibulum quam sapien varius ut blandit non interdum in ante
386,dui proin leo odio porttitor id consequat in consequat ut nulla sed accumsan felis ut at dolor quis odio
387,ac consequat metus sapien ut nunc vestibulum ante ipsum primis in faucibus orci luctus et ultrices posuere
388,blandit ultrices enim lorem ipsum dolor sit amet consectetuer adipiscing elit proin interdum mauris non ligula
389,venenatis tristique fusce congue diam id ornare imperdiet sapien urna pretium nisl
390,rhoncus mauris enim leo rhoncus sed vestibulum sit amet cursus id turpis integer
391,at lorem integer tincidunt ante vel ipsum praesent blandit lacinia
392,elementum eu interdum eu tincidunt in leo maecenas pulvinar lobortis est phasellus sit amet erat nulla tempus
393,velit eu est congue elementum in hac habitasse platea dictumst morbi vestibulum
394,tempus vivamus in felis eu sapien cursus vestibulum proin eu mi nulla ac enim in
395,vestibulum ante ipsum primis in faucibus orci luctus et ultrices posuere cubilia curae nulla dapibus dolor vel est donec
396,dis parturient montes nascetur ridiculus mus vivamus vestibulum sagittis sapien cum sociis natoque penatibus et magnis dis parturient
397,vulputate justo in blandit ultrices enim lorem ipsum dolor sit amet consectetuer adipiscing elit proin interdum mauris non ligula pellentesque
398,est lacinia nisi venenatis tristique fusce congue diam id ornare imperdiet sapien
399,fermentum donec ut mauris eget massa tempor convallis nulla neque libero convallis eget eleifend luctus ultricies eu nibh quisque id
400,blandit lacinia erat vestibulum sed magna at nunc commodo placerat praesent blandit
401,fermentum donec ut mauris eget massa tempor convallis nulla neque libero
402,in leo maecenas pulvinar lobortis est phasellus sit amet erat nulla tempus vivamus in felis
403,pellentesque viverra pede ac diam cras pellentesque volutpat dui maecenas tristique est et
404,vitae mattis nibh ligula nec sem duis aliquam convallis nunc proin at
405,integer a nibh in quis justo maecenas rhoncus aliquam lacus morbi quis tortor id nulla ultrices aliquet maecenas
406,eget tempus vel pede morbi porttitor lorem id ligula suspendisse ornare consequat lectus
407,eleifend quam a odio in hac habitasse platea dictumst maecenas ut massa
408,quisque porta volutpat erat quisque erat eros viverra eget congue eget semper rutrum nulla nunc purus phasellus in
409,lacinia nisi venenatis tristique fusce congue diam id ornare imperdiet sapien urna pretium nisl ut volutpat
410,arcu sed augue aliquam erat volutpat in congue etiam justo etiam
411,nulla dapibus dolor vel est donec odio justo sollicitudin ut suscipit a feugiat et eros vestibulum
412,purus eu magna vulputate luctus cum sociis natoque penatibus et magnis dis parturient montes nascetur ridiculus
413,enim lorem ipsum dolor sit amet consectetuer adipiscing elit proin interdum mauris non ligula pellentesque ultrices phasellus
414,lacus morbi sem mauris laoreet ut rhoncus aliquet pulvinar sed nisl nunc rhoncus
415,non quam nec dui luctus rutrum nulla tellus in sagittis dui vel nisl duis ac nibh fusce
416,ante ipsum primis in faucibus orci luctus et ultrices posuere cubilia
417,tempor turpis nec euismod scelerisque quam turpis adipiscing lorem vitae mattis nibh ligula nec sem duis aliquam convallis nunc
418,nibh ligula nec sem duis aliquam convallis nunc proin at turpis a pede posuere nonummy
419,mauris viverra diam vitae quam suspendisse potenti nullam porttitor lacus at turpis donec posuere metus vitae ipsum aliquam non
420,mi in porttitor pede justo eu massa donec dapibus duis at
421,at nibh in hac habitasse platea dictumst aliquam augue quam
422,non pretium quis lectus suspendisse potenti in eleifend quam a odio
423,a nibh in quis justo maecenas rhoncus aliquam lacus morbi quis tortor id nulla
424,tortor quis turpis sed ante vivamus tortor duis mattis egestas metus aenean fermentum donec ut mauris eget
425,odio elementum eu interdum eu tincidunt in leo maecenas pulvinar lobortis est phasellus
426,congue risus semper porta volutpat quam pede lobortis ligula sit amet eleifend pede libero quis orci nullam molestie
427,sociis natoque penatibus et magnis dis parturient montes nascetur ridiculus mus vivamus
428,quis tortor id nulla ultrices aliquet maecenas leo odio condimentum id
429,cursus id turpis integer aliquet massa id lobortis convallis tortor risus dapibus augue vel accumsan tellus nisi
430,elit ac nulla sed vel enim sit amet nunc viverra dapibus nulla suscipit ligula in lacus
431,pulvinar nulla pede ullamcorper augue a suscipit nulla elit ac nulla sed vel enim sit amet nunc
432,vestibulum vestibulum ante ipsum primis in faucibus orci luctus et ultrices
433,bibendum imperdiet nullam orci pede venenatis non sodales sed tincidunt
434,sed vel enim sit amet nunc viverra dapibus nulla suscipit ligula in lacus curabitur at ipsum ac tellus semper
435,ac enim in tempor turpis nec euismod scelerisque quam turpis adipiscing lorem vitae mattis
436,interdum eu tincidunt in leo maecenas pulvinar lobortis est phasellus sit amet erat nulla tempus vivamus
437,nulla dapibus dolor vel est donec odio justo sollicitudin ut suscipit a feugiat et
438,sed sagittis nam congue risus semper porta volutpat quam pede lobortis ligula sit
439,mattis pulvinar nulla pede ullamcorper augue a suscipit nulla elit ac nulla sed vel enim sit amet nunc viverra dapibus
440,vel enim sit amet nunc viverra dapibus nulla suscipit ligula in lacus curabitur at ipsum ac
441,mus vivamus vestibulum sagittis sapien cum sociis natoque penatibus et magnis
442,suspendisse accumsan tortor quis turpis sed ante vivamus tortor duis mattis egestas metus aenean fermentum donec ut mauris eget massa
443,enim in tempor turpis nec euismod scelerisque quam turpis adipiscing lorem vitae mattis
444,amet consectetuer adipiscing elit proin interdum mauris non ligula pellentesque ultrices phasellus id
445,lacinia sapien quis libero nullam sit amet turpis elementum ligula vehicula consequat morbi a
446,in imperdiet et commodo vulputate justo in blandit ultrices enim lorem ipsum dolor sit
447,erat nulla tempus vivamus in felis eu sapien cursus vestibulum proin eu mi nulla
448,convallis eget eleifend luctus ultricies eu nibh quisque id justo sit amet sapien dignissim vestibulum vestibulum ante
449,lobortis ligula sit amet eleifend pede libero quis orci nullam molestie nibh in lectus pellentesque at nulla suspendisse
450,consequat lectus in est risus auctor sed tristique in tempus sit amet sem
451,sit amet cursus id turpis integer aliquet massa id lobortis
452,praesent lectus vestibulum quam sapien varius ut blandit non interdum in ante vestibulum ante ipsum
453,urna pretium nisl ut volutpat sapien arcu sed augue aliquam erat volutpat
454,nulla nunc purus phasellus in felis donec semper sapien a libero nam dui proin leo odio porttitor id consequat in
455,non pretium quis lectus suspendisse potenti in eleifend quam a
456,ac diam cras pellentesque volutpat dui maecenas tristique est et tempus semper est quam pharetra magna
457,potenti in eleifend quam a odio in hac habitasse platea dictumst maecenas ut massa quis augue
458,molestie lorem quisque ut erat curabitur gravida nisi at nibh in hac habitasse platea dictumst aliquam augue quam sollicitudin
459,nulla pede ullamcorper augue a suscipit nulla elit ac nulla
460,nisl ut volutpat sapien arcu sed augue aliquam erat volutpat in congue etiam justo
461,sollicitudin vitae consectetuer eget rutrum at lorem integer tincidunt ante vel ipsum praesent blandit lacinia
462,cubilia curae donec pharetra magna vestibulum aliquet ultrices erat tortor
463,lectus vestibulum quam sapien varius ut blandit non interdum in ante vestibulum ante ipsum primis in
464,lacinia sapien quis libero nullam sit amet turpis elementum ligula
465,faucibus accumsan odio curabitur convallis duis consequat dui nec nisi
466,erat eros viverra eget congue eget semper rutrum nulla nunc purus phasellus
467,sodales sed tincidunt eu felis fusce posuere felis sed lacus morbi sem mauris laoreet ut rhoncus aliquet pulvinar sed nisl
468,integer ac neque duis bibendum morbi non quam nec dui luctus rutrum nulla
469,vestibulum ante ipsum primis in faucibus orci luctus et ultrices posuere cubilia curae
470,orci luctus et ultrices posuere cubilia curae donec pharetra magna vestibulum aliquet ultrices erat tortor sollicitudin mi sit amet lobortis
471,pede ullamcorper augue a suscipit nulla elit ac nulla sed vel enim
472,venenatis turpis enim blandit mi in porttitor pede justo eu massa donec dapibus duis at velit eu
473,orci eget orci vehicula condimentum curabitur in libero ut massa volutpat
474,neque vestibulum eget vulputate ut ultrices vel augue vestibulum ante ipsum
475,elit sodales scelerisque mauris sit amet eros suspendisse accumsan tortor quis turpis
476,aliquet ultrices erat tortor sollicitudin mi sit amet lobortis sapien sapien non mi
477,ornare consequat lectus in est risus auctor sed tristique in tempus sit amet sem fusce consequat nulla
478,quis orci eget orci vehicula condimentum curabitur in libero ut massa volutpat convallis morbi odio odio
479,vitae nisl aenean lectus pellentesque eget nunc donec quis orci eget orci vehicula
480,cursus vestibulum proin eu mi nulla ac enim in tempor turpis nec
481,curae donec pharetra magna vestibulum aliquet ultrices erat tortor sollicitudin mi sit amet lobortis sapien sapien
482,vestibulum ante ipsum primis in faucibus orci luctus et ultrices posuere cubilia curae donec pharetra magna vestibulum aliquet ultrices erat
483,sed magna at nunc commodo placerat praesent blandit nam nulla integer pede justo lacinia eget tincidunt eget tempus vel
484,nulla ac enim in tempor turpis nec euismod scelerisque quam turpis adipiscing lorem vitae mattis nibh ligula
485,ipsum integer a nibh in quis justo maecenas rhoncus aliquam
486,lectus vestibulum quam sapien varius ut blandit non interdum in ante vestibulum ante ipsum primis in faucibus orci luctus
487,pretium iaculis diam erat fermentum justo nec condimentum neque sapien placerat ante nulla justo aliquam quis turpis eget elit
488,non velit donec diam neque vestibulum eget vulputate ut ultrices vel augue vestibulum ante ipsum primis in
489,vitae consectetuer eget rutrum at lorem integer tincidunt ante vel ipsum praesent blandit lacinia erat vestibulum sed magna
490,congue risus semper porta volutpat quam pede lobortis ligula sit amet eleifend pede libero quis orci nullam
491,enim blandit mi in porttitor pede justo eu massa donec dapibus duis
492,ultrices posuere cubilia curae nulla dapibus dolor vel est donec odio justo sollicitudin ut suscipit a feugiat
493,platea dictumst aliquam augue quam sollicitudin vitae consectetuer eget rutrum at
494,at dolor quis odio consequat varius integer ac leo pellentesque ultrices mattis odio donec vitae nisi nam ultrices
495,condimentum neque sapien placerat ante nulla justo aliquam quis turpis eget elit sodales scelerisque mauris sit
496,mauris vulputate elementum nullam varius nulla facilisi cras non velit nec nisi vulputate
497,eget tincidunt eget tempus vel pede morbi porttitor lorem id ligula suspendisse ornare consequat lectus in
498,lobortis sapien sapien non mi integer ac neque duis bibendum morbi non quam
499,in faucibus orci luctus et ultrices posuere cubilia curae mauris viverra diam
500,nisl ut volutpat sapien arcu sed augue aliquam erat volutpat in congue etiam justo etiam pretium iaculis justo
501,odio consequat varius integer ac leo pellentesque ultrices mattis odio donec
502,nulla facilisi cras non velit nec nisi vulputate nonummy maecenas tincidunt lacus at velit
503,ante vestibulum ante ipsum primis in faucibus orci luctus et ultrices posuere cubilia curae duis faucibus accumsan odio curabitur convallis
504,bibendum morbi non quam nec dui luctus rutrum nulla tellus in sagittis dui vel nisl duis ac nibh
505,volutpat erat quisque erat eros viverra eget congue eget semper rutrum nulla nunc
506,dolor quis odio consequat varius integer ac leo pellentesque ultrices mattis odio donec vitae nisi nam ultrices libero
507,eget tempus vel pede morbi porttitor lorem id ligula suspendisse ornare consequat lectus in est risus auctor
508,vel nisl duis ac nibh fusce lacus purus aliquet at feugiat non pretium quis lectus suspendisse
509,tristique in tempus sit amet sem fusce consequat nulla nisl nunc nisl duis
510,sit amet turpis elementum ligula vehicula consequat morbi a ipsum integer a nibh in
511,cum sociis natoque penatibus et magnis dis parturient montes nascetur ridiculus
512,lacinia aenean sit amet justo morbi ut odio cras mi pede malesuada in imperdiet et commodo vulputate
513,nec condimentum neque sapien placerat ante nulla justo aliquam quis turpis eget elit sodales scelerisque mauris sit
